======================================================================
BATCH PROCESSING EDGAR WORKFLOW
Total splits: 3295
Batch size: 1000
======================================================================

Fetching CIK mapping...
✓ Loaded 10182 ticker mappings and 7924 company name mappings

======================================================================
BATCH 1: Processing next 1000 splits
======================================================================

Found 1000 splits to process in this batch

Processing: OPTN - Split: 1 : 15 on 12/31/2024
  ✗ No CIK found for OPTN (Optinose Inc)

Processing: TVRD - Split: 1 : 12 on 12/31/2024
  Querying EDGAR (CIK: 0001346830) from 2024-07-04 to 2025-01-15
  Found 6 relevant filings
    ✓ 8-K on 2024-12-30 - Score: 9 (Tier A)
    ✓ 8-K on 2024-12-18 - Score: 5 (Tier A)
    ✓ 8-K on 2024-11-22 - Score: 5 (Tier A)
    ✓ 10-Q on 2024-11-14 - Score: 5 (Tier A)
    ✓ 10-Q on 2024-08-14 - Score: 5 (Tier A)
    ✓ 8-K on 2024-08-01 - Score: 5 (Tier A)
  ✓ Saved 6 scored filings to MongoDB

Processing: COEP - Split: 1 : 20 on 12/31/2024
  Querying EDGAR (CIK: 0001759186) from 2024-07-04 to 2025-01-15
  Found 18 relevant filings
    ✓ S-1 on 2025-01-10 - Score: 7 (Tier A)
    ✓ 8-K on 2024-12-27 - Score: 7 (Tier A)
    ✓ 8-K on 2024-12-20 - Score: 4 (Tier B)
    ✓ 8-K on 2024-12-17 - Score: 4 (Tier B)
    ✓ 8-K on 2024-12-04 - Score: 4 (Tier B)
    ✓ 424B3 on 2024-11-22 - Score: 2 (Tier C)
    ✓ 424B3 on 2024-11-22 - Score: 2 (Tier C)
    ✓ DEF 14A on 2024-11-14 - Score: 6 (Tier A)
    ✓ 10-Q on 2024-11-13 - Score: 1 (Tier C)
    ✓ 8-K on 2024-11-06 - Score: 4 (Tier B)
  ✓ Saved 10 scored filings to MongoDB

Processing: OST - Split: 1 : 10 on 12/31/2024
  Querying EDGAR (CIK: 0001803407) from 2024-07-04 to 2025-01-15
  Found 7 relevant filings
    ✓ 6-K on 2024-12-20 - Score: 8 (Tier A)
    ✓ 6-K on 2024-11-27 - Score: 0 (Tier F)
    ✓ 424B5 on 2024-11-19 - Score: 6 (Tier A)
    ✓ 6-K on 2024-11-08 - Score: 0 (Tier F)
    ✓ 6-K on 2024-10-04 - Score: 0 (Tier F)
    ✓ 6-K on 2024-08-26 - Score: 0 (Tier F)
    ✓ 6-K on 2024-07-24 - Score: 5 (Tier A)
  ✓ Saved 7 scored filings to MongoDB

Processing: ENVB - Split: 1 : 4 on 12/31/2020
  Querying EDGAR (CIK: 0000890821) from 2020-07-04 to 2021-01-15
  Found 17 relevant filings
    ✓ 8-K on 2021-01-15 - Score: 3 (Tier B)
    ✓ 424B5 on 2021-01-13 - Score: 8 (Tier A)
    ✓ 8-K on 2021-01-12 - Score: 5 (Tier A)
    ✓ 8-K on 2021-01-06 - Score: 7 (Tier A)
    ✓ 8-K on 2021-01-06 - Score: 11 (Tier A)
    ✓ 8-K on 2020-12-29 - Score: 4 (Tier B)
    ✓ 8-K on 2020-12-23 - Score: 5 (Tier A)
    ✓ 8-K on 2020-12-18 - Score: 4 (Tier B)
    ✓ 8-K on 2020-12-15 - Score: 4 (Tier B)
    ✓ 10-Q on 2020-11-16 - Score: 3 (Tier B)
  ✓ Saved 10 scored filings to MongoDB

Processing: MTVA - Split: 1 : 25 on 12/31/2019
  Querying EDGAR (CIK: 0001638287) from 2019-07-04 to 2020-01-15
  Found 14 relevant filings
    ✓ 8-K on 2020-01-13 - Score: 4 (Tier B)
    ✓ 8-K on 2019-12-31 - Score: 10 (Tier A)
    ✓ 8-K on 2019-12-30 - Score: 4 (Tier B)
    ✓ 8-K on 2019-12-06 - Score: 4 (Tier B)
    ✓ 10-Q on 2019-11-08 - Score: 3 (Tier B)
    ✓ 424B3 on 2019-11-06 - Score: 4 (Tier B)
    ✓ 8-K on 2019-10-29 - Score: 5 (Tier A)
    ✓ 8-K on 2019-10-08 - Score: 5 (Tier A)
    ✓ 8-K on 2019-10-03 - Score: 5 (Tier A)
    ✓ 8-K on 2019-09-24 - Score: 4 (Tier B)
  ✓ Saved 10 scored filings to MongoDB

Processing: ATXS - Split: 1 : 10 on 12/31/2018
  Querying EDGAR (CIK: 0001454789) from 2018-07-04 to 2019-01-15
  Found 12 relevant filings
    ✓ 8-K on 2019-01-09 - Score: 7 (Tier A)
    ✓ 424B3 on 2018-12-31 - Score: 1 (Tier C)
    ✓ 8-K on 2018-12-31 - Score: 0 (Tier F)
    ✓ 8-K on 2018-12-14 - Score: 6 (Tier A)
    ✓ 424B3 on 2018-11-13 - Score: 6 (Tier A)
    ✓ 8-K on 2018-11-13 - Score: 3 (Tier B)
    ✓ 424B5 on 2018-11-13 - Score: 4 (Tier B)
    ✓ 10-Q on 2018-11-13 - Score: 5 (Tier A)
    ✓ DEF 14A on 2018-10-23 - Score: 6 (Tier A)
    ✓ 8-K on 2018-10-16 - Score: 0 (Tier F)
  ✓ Saved 10 scored filings to MongoDB

Processing: EGO - Split: 1 : 5 on 12/31/2018
  Querying EDGAR (CIK: 0000918608) from 2018-07-04 to 2019-01-15
  Found 12 relevant filings
    ✓ 6-K on 2018-12-27 - Score: 0 (Tier F)
    ✓ 6-K on 2018-12-18 - Score: 0 (Tier F)
    ✓ 6-K on 2018-11-26 - Score: 0 (Tier F)
    ✓ 6-K on 2018-10-26 - Score: 0 (Tier F)
    ✓ 6-K on 2018-10-26 - Score: 0 (Tier F)
    ✓ 6-K on 2018-10-26 - Score: 0 (Tier F)
    ✓ 6-K on 2018-10-01 - Score: 0 (Tier F)
    ✓ 6-K on 2018-09-18 - Score: 0 (Tier F)
    ✓ 6-K on 2018-08-02 - Score: 0 (Tier F)
    ✓ 6-K on 2018-07-27 - Score: 0 (Tier F)
  ✓ Saved 10 scored filings to MongoDB

Processing: QIPT - Split: 1 : 5 on 12/31/2018
  Querying EDGAR (CIK: 0001540013) from 2018-07-04 to 2019-01-15
  Found 0 relevant filings
  ⚠ No filings in date window
     Date window: [2018-07-04 to 2019-01-15]
     Total filings available for CIK: 200
     Filing date range available: 2012-01-19 to 2025-11-07
     All forms (top 10): {'6-K': 85, 'D': 25, '4': 16, '8-K': 12, '3': 9, 'SCHEDULE 13D/A': 7, 'DEFA14A': 5, 'SC 13G/A': 4, '10-Q': 3, 'SC 13G': 3}

Processing: NETI - Split: 1 : 12 on 12/31/2015
  ✓ Found CIK via company name: 0001674930
  Querying EDGAR (CIK: 0001674930) from 2015-07-04 to 2016-01-15
  Found 0 relevant filings
  ⚠ Historical split: SEC API only returns filings from 2016-06-09 onwards (split date: 12/31/2015)
     Date window: [2015-07-04 to 2016-01-15]
     Total filings available for CIK: 585
     Filing date range available: 2016-06-09 to 2025-11-07

Processing: WAVXQ - Split: 1 : 10 on 12/31/2015
  ✗ No CIK found for WAVXQ (Wave Systems Corp)

Processing: NADLQ - Split: 1 : 10 on 12/31/2015
  ✗ No CIK found for NADLQ (North Atlantic Drilling Ltd.)

Processing: ALSE - Split: 1 : 5,000 on 12/31/2014
  ✗ No CIK found for ALSE (Alseres Pharmaceuticals Inc)

Processing: OPNT - Split: 1 : 100 on 12/31/2014
  ✗ No CIK found for OPNT (Opiant Pharmaceuticals Inc)

Processing: TCX - Split: 1 : 4 on 12/31/2013
  Querying EDGAR (CIK: 0000909494) from 2013-07-04 to 2014-01-15
  Found 11 relevant filings
    ✓ 8-K on 2014-01-03 - Score: 10 (Tier A)
    ✓ 8-K on 2013-12-18 - Score: 9 (Tier A)
    ✓ 8-K on 2013-12-06 - Score: 5 (Tier A)
    ✓ 8-K on 2013-11-14 - Score: 0 (Tier F)
    ✓ 10-Q on 2013-11-13 - Score: 2 (Tier C)
    ✓ DEF 14A on 2013-10-21 - Score: 5 (Tier A)
    ✓ PRE 14A on 2013-09-25 - Score: 6 (Tier A)
    ✓ 8-K on 2013-09-12 - Score: 0 (Tier F)
    ✓ 8-K on 2013-08-09 - Score: 0 (Tier F)
    ✓ 10-Q on 2013-08-09 - Score: 2 (Tier C)
  ✓ Saved 10 scored filings to MongoDB

Processing: SOQDF - Split: 1 : 1.11 on 12/31/2013
  ✗ No CIK found for SOQDF (Sonde Resources Corp)

Processing: DFDV - Split: 1 : 8 on 12/30/2024
  Querying EDGAR (CIK: 0001805526) from 2024-07-03 to 2025-01-14
  Found 9 relevant filings
    ✓ 8-K on 2024-12-30 - Score: 9 (Tier A)
    ✓ 8-K on 2024-12-20 - Score: 4 (Tier B)
    ✓ PRE 14C on 2024-11-29 - Score: 6 (Tier A)
    ✓ 10-Q on 2024-11-07 - Score: 5 (Tier A)
    ✓ DEF 14A on 2024-11-04 - Score: 7 (Tier A)
    ✓ PRE 14A on 2024-10-23 - Score: 7 (Tier A)
    ✓ 10-Q on 2024-08-13 - Score: 5 (Tier A)
    ✓ S-3 on 2024-08-01 - Score: 6 (Tier A)
    ✓ 8-K on 2024-07-19 - Score: 5 (Tier A)
  ✓ Saved 9 scored filings to MongoDB

Processing: TRNR - Split: 1 : 149.93 on 12/30/2022
  Querying EDGAR (CIK: 0001785056) from 2022-07-03 to 2023-01-14
  Found 0 relevant filings
  ⚠ No filings in date window
     Date window: [2022-07-03 to 2023-01-14]
     Total filings available for CIK: 269
     Filing date range available: 2019-08-13 to 2025-11-14
     Forms in date window (not matching target forms): {'UPLOAD': 2, 'DRSLTR': 2, 'DRS/A': 1, 'DRS': 1, 'D': 1, 'D/A': 1}

Processing: CHRA - Split: 1 : 10 on 12/30/2022
  ✗ No CIK found for CHRA (Charah Solutions Inc)

Processing: IRON - Split: 1 : 10 on 12/30/2022
  Querying EDGAR (CIK: 0001816736) from 2022-07-03 to 2023-01-14
  Found 11 relevant filings
    ✓ 8-K on 2022-12-29 - Score: 9 (Tier A)
    ✓ 8-K on 2022-12-28 - Score: 4 (Tier B)
    ✓ 8-K on 2022-12-27 - Score: 4 (Tier B)
    ✓ 8-K on 2022-12-13 - Score: 4 (Tier B)
    ✓ 8-K on 2022-12-08 - Score: 5 (Tier A)
    ✓ 424B3 on 2022-12-02 - Score: 7 (Tier A)
    ✓ 10-Q on 2022-11-10 - Score: 3 (Tier B)
    ✓ 8-K on 2022-10-31 - Score: 4 (Tier B)
    ✓ 10-Q on 2022-08-11 - Score: 3 (Tier B)
    ✓ 8-K on 2022-08-10 - Score: 4 (Tier B)
  ✓ Saved 10 scored filings to MongoDB

Processing: PETV - Split: 1 : 4 on 12/30/2020
  Querying EDGAR (CIK: 0001512922) from 2020-07-03 to 2021-01-14
  Found 14 relevant filings
    ✓ 8-K on 2020-12-29 - Score: 0 (Tier F)
    ✓ 8-K on 2020-12-10 - Score: 0 (Tier F)
    ✓ 8-K on 2020-12-04 - Score: 0 (Tier F)
    ✓ 8-K on 2020-11-23 - Score: 0 (Tier F)
    ✓ 10-Q on 2020-11-16 - Score: 5 (Tier A)
    ✓ 8-K on 2020-11-12 - Score: 0 (Tier F)
    ✓ 8-K on 2020-10-27 - Score: 4 (Tier B)
    ✓ 8-K on 2020-10-26 - Score: 4 (Tier B)
    ✓ S-1 on 2020-10-13 - Score: 6 (Tier A)
    ✓ 8-K on 2020-09-24 - Score: 0 (Tier F)
  ✓ Saved 10 scored filings to MongoDB

Processing: APEN - Split: 1 : 5.5 on 12/30/2016
  ✗ No CIK found for APEN (Apollo Endosurgery Inc)

Processing: WTER - Split: 1 : 50 on 12/30/2015
  Querying EDGAR (CIK: 0001532390) from 2015-07-03 to 2016-01-14
  Found 9 relevant filings
    ✓ DEF 14A on 2016-01-13 - Score: 0 (Tier F)
    ✓ PRE 14A on 2015-12-31 - Score: 0 (Tier F)
    ✓ 8-K on 2015-12-30 - Score: 5 (Tier A)
    ✓ 8-K on 2015-12-04 - Score: 0 (Tier F)
    ✓ 8-K on 2015-12-01 - Score: 0 (Tier F)
    ✓ 10-Q on 2015-11-23 - Score: 2 (Tier C)
    ✓ 10-Q on 2015-08-18 - Score: 2 (Tier C)
    ✓ 8-K on 2015-07-15 - Score: 0 (Tier F)
    ✓ 10-K on 2015-07-14 - Score: 5 (Tier A)
  ✓ Saved 9 scored filings to MongoDB

Processing: OIBR.C - Split: 1 : 10 on 12/30/2014
  ✗ No CIK found for OIBR.C (Oi SA)

Processing: NOVB - Split: 1 : 5 on 12/30/2010
  ✗ No CIK found for NOVB (North Valley Bancorp)

Processing: HSKA - Split: 1 : 10 on 12/30/2010
  ✗ No CIK found for HSKA (Heska Corp)

Processing: AVTX - Split: 1 : 239.81 on 12/29/2023
  Querying EDGAR (CIK: 0001534120) from 2023-07-02 to 2024-01-13
  Found 25 relevant filings
    ✓ 8-K on 2023-12-28 - Score: 8 (Tier A)
    ✓ 8-K on 2023-12-20 - Score: 5 (Tier A)
    ✓ DEFA14A on 2023-12-07 - Score: 5 (Tier A)
    ✓ 8-K on 2023-12-07 - Score: 6 (Tier A)
    ✓ 8-K on 2023-11-16 - Score: 5 (Tier A)
    ✓ 10-Q on 2023-11-09 - Score: 5 (Tier A)
    ✓ 8-K on 2023-11-09 - Score: 0 (Tier F)
    ✓ 8-K on 2023-10-31 - Score: 0 (Tier F)
    ✓ DEFA14A on 2023-10-19 - Score: 4 (Tier B)
    ✓ DEF 14A on 2023-10-19 - Score: 6 (Tier A)
  ✓ Saved 10 scored filings to MongoDB

Processing: VS - Split: 1 : 16 on 12/29/2023
  Querying EDGAR (CIK: 0001701963) from 2023-07-02 to 2024-01-13
  Found 6 relevant filings
    ✓ 8-K on 2024-01-12 - Score: 5 (Tier A)
    ✓ 6-K on 2023-12-06 - Score: 0 (Tier F)
    ✓ 6-K on 2023-12-04 - Score: 0 (Tier F)
    ✓ 6-K on 2023-11-14 - Score: 0 (Tier F)
    ✓ 6-K on 2023-10-17 - Score: 4 (Tier B)
    ✓ 6-K on 2023-08-14 - Score: 0 (Tier F)
  ✓ Saved 6 scored filings to MongoDB

Processing: IMG - Split: 1 : 35 on 12/29/2022
  Querying EDGAR (CIK: 0001527613) from 2022-07-02 to 2023-01-13
  Found 14 relevant filings
    ✓ 8-K on 2022-12-28 - Score: 7 (Tier A)
    ✓ 10-K on 2022-12-23 - Score: 5 (Tier A)
    ✓ 8-K on 2022-12-14 - Score: 6 (Tier A)
    ✓ 8-K on 2022-12-12 - Score: 5 (Tier A)
    ✓ DEFA14A on 2022-11-10 - Score: 5 (Tier A)
    ✓ 8-K on 2022-11-04 - Score: 7 (Tier A)
    ✓ DEF 14A on 2022-11-03 - Score: 6 (Tier A)
    ✓ PRE 14A on 2022-10-14 - Score: 5 (Tier A)
    ✓ 8-K on 2022-09-23 - Score: 5 (Tier A)
    ✓ 10-Q on 2022-08-12 - Score: 3 (Tier B)
  ✓ Saved 10 scored filings to MongoDB

Processing: BRFH - Split: 1 : 13 on 12/29/2021
  Querying EDGAR (CIK: 0001487197) from 2021-07-02 to 2022-01-13
  Found 6 relevant filings
    ✓ 8-K on 2022-01-06 - Score: 6 (Tier A)
    ✓ 8-K on 2021-12-29 - Score: 6 (Tier A)
    ✓ 8-K on 2021-11-15 - Score: 5 (Tier A)
    ✓ 10-Q on 2021-11-15 - Score: 0 (Tier F)
    ✓ 8-K on 2021-08-11 - Score: 5 (Tier A)
    ✓ 10-Q on 2021-08-11 - Score: 0 (Tier F)
  ✓ Saved 6 scored filings to MongoDB

Processing: DXF - Split: 1 : 3 on 12/29/2017
  Querying EDGAR (CIK: 0001499494) from 2017-07-02 to 2018-01-13
  Found 7 relevant filings
    ✓ 6-K on 2017-12-29 - Score: 0 (Tier F)
    ✓ 6-K on 2017-12-28 - Score: 4 (Tier B)
    ✓ 6-K on 2017-12-26 - Score: 4 (Tier B)
    ✓ 6-K on 2017-12-11 - Score: 7 (Tier A)
    ✓ 6-K on 2017-12-11 - Score: 0 (Tier F)
    ✓ 6-K on 2017-10-12 - Score: 0 (Tier F)
    ✓ 6-K on 2017-08-29 - Score: 0 (Tier F)
  ✓ Saved 7 scored filings to MongoDB

Processing: BKYI - Split: 1 : 12 on 12/29/2016
  Querying EDGAR (CIK: 0001019034) from 2016-07-02 to 2017-01-13
  Found 6 relevant filings
    ✓ 8-K on 2016-12-28 - Score: 6 (Tier A)
    ✓ S-1 on 2016-11-23 - Score: 6 (Tier A)
    ✓ 8-K on 2016-11-21 - Score: 0 (Tier F)
    ✓ 10-Q on 2016-11-14 - Score: 2 (Tier C)
    ✓ 8-K on 2016-08-25 - Score: 0 (Tier F)
    ✓ 10-Q on 2016-08-15 - Score: 2 (Tier C)
  ✓ Saved 6 scored filings to MongoDB

Processing: IDXG - Split: 1 : 10 on 12/29/2016
  Querying EDGAR (CIK: 0001054102) from 2016-07-02 to 2017-01-13
  Found 24 relevant filings
    ✓ 8-K on 2017-01-06 - Score: 0 (Tier F)
    ✓ 424B5 on 2017-01-05 - Score: 4 (Tier B)
    ✓ 8-K on 2017-01-03 - Score: 4 (Tier B)
    ✓ 8-K on 2016-12-28 - Score: 6 (Tier A)
    ✓ 8-K on 2016-12-21 - Score: 0 (Tier F)
    ✓ 424B5 on 2016-12-21 - Score: 4 (Tier B)
    ✓ 8-K on 2016-12-19 - Score: 4 (Tier B)
    ✓ 8-K on 2016-11-29 - Score: 5 (Tier A)
    ✓ 8-K on 2016-11-18 - Score: 0 (Tier F)
    ✓ 10-Q on 2016-11-17 - Score: 3 (Tier B)
  ✓ Saved 10 scored filings to MongoDB

Processing: OIBRQ - Split: 1 : 10 on 12/29/2014
  ✗ No CIK found for OIBRQ (Oi SA)

Processing: ATNY - Split: 1 : 4 on 12/29/2010
  ✗ No CIK found for ATNY (Api Technologies Corp)

Processing: AEI - Split: 1 : 20 on 12/28/2022
  Querying EDGAR (CIK: 0001750106) from 2022-07-01 to 2023-01-12
  Found 17 relevant filings
    ✓ 8-K on 2022-12-28 - Score: 8 (Tier A)
    ✓ 8-K on 2022-12-15 - Score: 5 (Tier A)
    ✓ 8-K on 2022-12-12 - Score: 8 (Tier A)
    ✓ 8-K on 2022-12-05 - Score: 7 (Tier A)
    ✓ 8-K on 2022-12-02 - Score: 5 (Tier A)
    ✓ 10-Q on 2022-11-14 - Score: 5 (Tier A)
    ✓ 8-K on 2022-11-03 - Score: 5 (Tier A)
    ✓ DEF 14A on 2022-10-24 - Score: 7 (Tier A)
    ✓ PRE 14A on 2022-10-14 - Score: 7 (Tier A)
    ✓ 8-K on 2022-10-07 - Score: 4 (Tier B)
  ✓ Saved 10 scored filings to MongoDB

Processing: ZVRA - Split: 1 : 16 on 12/28/2020
  Querying EDGAR (CIK: 0001434647) from 2020-07-01 to 2021-01-12
  Found 20 relevant filings
    ✓ 8-K on 2021-01-05 - Score: 0 (Tier F)
    ✓ 8-K on 2020-12-28 - Score: 0 (Tier F)
    ✓ 8-K on 2020-12-28 - Score: 7 (Tier A)
    ✓ 8-K on 2020-12-21 - Score: 5 (Tier A)
    ✓ S-1 on 2020-11-25 - Score: 6 (Tier A)
    ✓ 8-K on 2020-11-23 - Score: 0 (Tier F)
    ✓ DEFA14A on 2020-11-23 - Score: 0 (Tier F)
    ✓ 8-K on 2020-11-19 - Score: 6 (Tier A)
    ✓ 10-Q on 2020-10-30 - Score: 3 (Tier B)
    ✓ 8-K on 2020-10-29 - Score: 0 (Tier F)
  ✓ Saved 10 scored filings to MongoDB

Processing: CSR - Split: 1 : 10 on 12/28/2018
  Querying EDGAR (CIK: 0000798359) from 2018-07-01 to 2019-01-12
  Found 13 relevant filings
    ✓ 8-K on 2019-01-09 - Score: 0 (Tier F)
    ✓ 8-K on 2018-12-17 - Score: 7 (Tier A)
    ✓ 8-K on 2018-12-10 - Score: 0 (Tier F)
    ✓ 10-Q on 2018-12-10 - Score: 2 (Tier C)
    ✓ 8-K on 2018-11-06 - Score: 0 (Tier F)
    ✓ 8-K on 2018-09-27 - Score: 0 (Tier F)
    ✓ 8-K on 2018-09-20 - Score: 0 (Tier F)
    ✓ 8-K on 2018-09-18 - Score: 0 (Tier F)
    ✓ 8-K on 2018-09-10 - Score: 0 (Tier F)
    ✓ 10-Q on 2018-09-10 - Score: 2 (Tier C)
  ✓ Saved 10 scored filings to MongoDB

Processing: IMMP - Split: 1 : 3.33 on 12/28/2016
  Querying EDGAR (CIK: 0001506184) from 2016-07-01 to 2017-01-12
  Found 29 relevant filings
    ✓ 6-K on 2017-01-12 - Score: 0 (Tier F)
    ✓ 6-K on 2017-01-09 - Score: 0 (Tier F)
    ✓ 6-K on 2017-01-06 - Score: 0 (Tier F)
    ✓ 6-K on 2017-01-05 - Score: 0 (Tier F)
    ✓ 6-K on 2017-01-04 - Score: 0 (Tier F)
    ✓ 6-K on 2016-12-29 - Score: 0 (Tier F)
    ✓ 6-K on 2016-12-22 - Score: 0 (Tier F)
    ✓ 6-K on 2016-12-21 - Score: 0 (Tier F)
    ✓ 6-K on 2016-12-20 - Score: 0 (Tier F)
    ✓ 6-K on 2016-12-07 - Score: 0 (Tier F)
  ✓ Saved 10 scored filings to MongoDB

Processing: USAS - Split: 1 : 12 on 12/28/2016
  Querying EDGAR (CIK: 0001286973) from 2016-07-01 to 2017-01-12
  Found 0 relevant filings
  ⚠ No filings in date window
     Date window: [2016-07-01 to 2017-01-12]
     Total filings available for CIK: 314
     Filing date range available: 2004-04-13 to 2025-11-14
     Forms in date window (not matching target forms): {'CERTNYS': 1, 'F-X': 1, '40FR12B': 1}

Processing: HKRSQ - Split: 1 : 5 on 12/28/2015
  ✓ Found CIK via company name: 0001167379
  Querying EDGAR (CIK: 0001167379) from 2015-07-01 to 2016-01-12
  Found 0 relevant filings
  ⚠ No filings in date window
     Date window: [2015-07-01 to 2016-01-12]
     Total filings available for CIK: 516
     Filing date range available: 2002-02-22 to 2025-11-12
     All forms (top 10): {'6-K': 378, '144': 18, '20-F': 15, 'UPLOAD': 11, 'SC 13G/A': 9, 'SC 13G': 8, '11-K': 8, 'CORRESP': 7, 'SC 13D/A': 7, '425': 7}

Processing: YGEHY - Split: 1 : 10 on 12/28/2015
  ✗ No CIK found for YGEHY (Yingli Green Energy Holding Co Ltd.)

Processing: OTLC - Split: 1 : 12 on 12/28/2012
  Querying EDGAR (CIK: 0000908259) from 2012-07-01 to 2013-01-12
  Found 20 relevant filings
    ✓ 8-K on 2012-12-27 - Score: 10 (Tier A)
    ✓ 8-K on 2012-12-10 - Score: 0 (Tier F)
    ✓ 424B3 on 2012-11-27 - Score: 5 (Tier A)
    ✓ 8-K on 2012-11-21 - Score: 0 (Tier F)
    ✓ DEFA14A on 2012-11-19 - Score: 3 (Tier B)
    ✓ DEF 14A on 2012-11-19 - Score: 6 (Tier A)
    ✓ 10-Q on 2012-11-09 - Score: 4 (Tier B)
    ✓ PRE 14A on 2012-11-09 - Score: 6 (Tier A)
    ✓ 8-K on 2012-11-08 - Score: 6 (Tier A)
    ✓ DEFA14A on 2012-11-08 - Score: 5 (Tier A)
  ✓ Saved 10 scored filings to MongoDB

Processing: MDSYF - Split: 1 : 4 on 12/28/2011
  ✓ Found CIK via company name: 0001018963
  Querying EDGAR (CIK: 0001018963) from 2011-07-01 to 2012-01-12
  Found 0 relevant filings
  ⚠ Historical split: SEC API only returns filings from 2013-03-21 onwards (split date: 12/28/2011)
     Date window: [2011-07-01 to 2012-01-12]
     Total filings available for CIK: 1000
     Filing date range available: 2013-03-21 to 2025-11-13

Processing: PCBC - Split: 1 : 100 on 12/28/2010
  ✓ Found CIK via company name: 0001419536
  Querying EDGAR (CIK: 0001419536) from 2010-07-01 to 2011-01-12
  Found 0 relevant filings
  ⚠ No filings in date window
     Date window: [2010-07-01 to 2011-01-12]
     Total filings available for CIK: 634
     Filing date range available: 2007-11-26 to 2025-11-14
     All forms (top 10): {'4': 350, '8-K': 100, '3': 32, '10-Q': 22, 'SC 13G/A': 19, '4/A': 18, '5': 14, 'SC 13G': 8, 'DEF 14A': 7, '10-K': 7}

Processing: CHAI - Split: 1 : 10 on 12/27/2024
  Querying EDGAR (CIK: 0001649009) from 2024-06-30 to 2025-01-11
  Found 37 relevant filings
    ✓ 6-K on 2025-01-08 - Score: 0 (Tier F)
    ✓ 6-K on 2024-12-26 - Score: 0 (Tier F)
    ✓ 6-K on 2024-12-19 - Score: 5 (Tier A)
    ✓ 6-K on 2024-12-17 - Score: 0 (Tier F)
    ✓ 6-K on 2024-12-12 - Score: 0 (Tier F)
    ✓ 6-K on 2024-12-11 - Score: 0 (Tier F)
    ✓ 6-K on 2024-12-09 - Score: 0 (Tier F)
    ✓ 6-K on 2024-11-26 - Score: 0 (Tier F)
    ✓ 6-K on 2024-11-15 - Score: 0 (Tier F)
    ✓ 424B3 on 2024-11-14 - Score: 6 (Tier A)
  ✓ Saved 10 scored filings to MongoDB

Progress: 50/1000 splits processed

Processing: NXUR - Split: 1 : 149.93 on 12/27/2023
  Querying EDGAR (CIK: 0001722969) from 2023-06-30 to 2024-01-11
  Found 20 relevant filings
    ✓ PRE 14C on 2024-01-05 - Score: 5 (Tier A)
    ✓ 8-K on 2023-12-27 - Score: 7 (Tier A)
    ✓ 8-K on 2023-12-22 - Score: 7 (Tier A)
    ✓ 8-K on 2023-12-18 - Score: 4 (Tier B)
    ✓ 8-K on 2023-12-05 - Score: 6 (Tier A)
    ✓ 8-K on 2023-11-24 - Score: 3 (Tier B)
    ✓ 424B5 on 2023-11-24 - Score: 6 (Tier A)
    ✓ PRE 14C on 2023-11-17 - Score: 6 (Tier A)
    ✓ 10-Q on 2023-11-13 - Score: 1 (Tier C)
    ✓ 8-K on 2023-10-23 - Score: 3 (Tier B)
  ✓ Saved 10 scored filings to MongoDB

Processing: LIDR - Split: 1 : 30 on 12/27/2023
  Querying EDGAR (CIK: 0001818644) from 2023-06-30 to 2024-01-11
  Found 19 relevant filings
    ✓ 8-K on 2023-12-29 - Score: 7 (Tier A)
    ✓ 8-K on 2023-12-22 - Score: 5 (Tier A)
    ✓ 8-K on 2023-12-18 - Score: 4 (Tier B)
    ✓ 8-K on 2023-12-13 - Score: 5 (Tier A)
    ✓ 10-Q on 2023-11-09 - Score: 4 (Tier B)
    ✓ 8-K on 2023-11-09 - Score: 4 (Tier B)
    ✓ 8-K on 2023-11-07 - Score: 5 (Tier A)
    ✓ 8-K on 2023-11-06 - Score: 5 (Tier A)
    ✓ DEFA14A on 2023-10-31 - Score: 0 (Tier F)
    ✓ DEF 14A on 2023-10-31 - Score: 6 (Tier A)
  ✓ Saved 10 scored filings to MongoDB

Processing: HOFV - Split: 1 : 22 on 12/27/2022
  Querying EDGAR (CIK: 0001708176) from 2022-06-30 to 2023-01-11
  Found 20 relevant filings
    ✓ 8-K on 2022-12-27 - Score: 10 (Tier A)
    ✓ 8-K on 2022-12-09 - Score: 5 (Tier A)
    ✓ 8-K on 2022-11-23 - Score: 7 (Tier A)
    ✓ 8-K on 2022-11-14 - Score: 4 (Tier B)
    ✓ 10-Q on 2022-11-14 - Score: 5 (Tier A)
    ✓ 8-K on 2022-11-09 - Score: 4 (Tier B)
    ✓ 8-K on 2022-10-25 - Score: 5 (Tier A)
    ✓ 8-K on 2022-09-30 - Score: 6 (Tier A)
    ✓ 8-K on 2022-09-29 - Score: 5 (Tier A)
    ✓ 8-K on 2022-09-20 - Score: 5 (Tier A)
  ✓ Saved 10 scored filings to MongoDB

Processing: RCON - Split: 1 : 5 on 12/27/2019
  Querying EDGAR (CIK: 0001442620) from 2019-06-30 to 2020-01-11
  Found 6 relevant filings
    ✓ 6-K on 2019-12-26 - Score: 7 (Tier A)
    ✓ 6-K on 2019-12-10 - Score: 0 (Tier F)
    ✓ 6-K on 2019-12-03 - Score: 0 (Tier F)
    ✓ 6-K on 2019-11-05 - Score: 0 (Tier F)
    ✓ 20-F on 2019-10-01 - Score: 5 (Tier A)
    ✓ 6-K on 2019-07-18 - Score: 5 (Tier A)
  ✓ Saved 6 scored filings to MongoDB

Processing: BASXQ - Split: 1 : 571.43 on 12/27/2016
  ✗ No CIK found for BASXQ (Basic Energy Services Inc)

Processing: SHSP - Split: 1 : 5 on 12/27/2013
  ✗ No CIK found for SHSP (Sharpspring Inc)

Processing: VPCO - Split: 1 : 5 on 12/27/2013
  ✗ No CIK found for VPCO (Vapor Corp)

Processing: MRVC - Split: 1 : 20 on 12/27/2012
  ✓ Found CIK via company name: 0001018963
  Querying EDGAR (CIK: 0001018963) from 2012-06-30 to 2013-01-11
  Found 0 relevant filings
  ⚠ Historical split: SEC API only returns filings from 2013-03-21 onwards (split date: 12/27/2012)
     Date window: [2012-06-30 to 2013-01-11]
     Total filings available for CIK: 1000
     Filing date range available: 2013-03-21 to 2025-11-13

Processing: GOEVQ - Split: 1 : 20 on 12/24/2024
  Querying EDGAR (CIK: 0001750153) from 2024-06-27 to 2025-01-08
  Found 31 relevant filings
    ✓ 8-K on 2024-12-20 - Score: 8 (Tier A)
    ✓ 8-K on 2024-12-13 - Score: 7 (Tier A)
    ✓ 8-K on 2024-12-06 - Score: 7 (Tier A)
    ✓ 8-K on 2024-11-27 - Score: 4 (Tier B)
    ✓ 424B5 on 2024-11-27 - Score: 5 (Tier A)
    ✓ DEFA14A on 2024-11-26 - Score: 0 (Tier F)
    ✓ DEFA14A on 2024-11-22 - Score: 5 (Tier A)
    ✓ 10-Q on 2024-11-14 - Score: 5 (Tier A)
    ✓ 8-K on 2024-11-13 - Score: 4 (Tier B)
    ✓ 8-K on 2024-11-05 - Score: 5 (Tier A)
  ✓ Saved 10 scored filings to MongoDB

Processing: NEUP - Split: 1 : 12 on 12/24/2024
  Querying EDGAR (CIK: 0001191070) from 2024-06-27 to 2025-01-08
  Found 14 relevant filings
    ✓ 8-K on 2024-12-23 - Score: 4 (Tier B)
    ✓ 8-K on 2024-12-16 - Score: 4 (Tier B)
    ✓ 8-K on 2024-12-12 - Score: 6 (Tier A)
    ✓ 8-K on 2024-11-21 - Score: 4 (Tier B)
    ✓ S-3 on 2024-11-18 - Score: 5 (Tier A)
    ✓ 10-Q on 2024-11-14 - Score: 5 (Tier A)
    ✓ DEFA14A on 2024-11-13 - Score: 4 (Tier B)
    ✓ DEF 14A on 2024-11-12 - Score: 6 (Tier A)
    ✓ 8-K on 2024-11-08 - Score: 6 (Tier A)
    ✓ 8-K on 2024-10-10 - Score: 6 (Tier A)
  ✓ Saved 10 scored filings to MongoDB

Processing: CLEUF - Split: 1 : 15 on 12/24/2024
  ✓ Found CIK via company name: 0001018963
  Querying EDGAR (CIK: 0001018963) from 2024-06-27 to 2025-01-08
  Found 4 relevant filings
    ✓ 10-Q on 2024-10-29 - Score: 2 (Tier C)
    ✓ 8-K on 2024-10-29 - Score: 0 (Tier F)
    ✓ 10-Q on 2024-08-06 - Score: 2 (Tier C)
    ✓ 8-K on 2024-08-06 - Score: 0 (Tier F)
  ✓ Saved 4 scored filings to MongoDB

Processing: DCTH - Split: 1 : 699.3 on 12/24/2019
  Querying EDGAR (CIK: 0000872912) from 2019-06-27 to 2020-01-08
  Found 24 relevant filings
    ✓ 424B3 on 2020-01-07 - Score: 6 (Tier A)
    ✓ S-1 on 2019-12-30 - Score: 6 (Tier A)
    ✓ 8-K on 2019-12-30 - Score: 8 (Tier A)
    ✓ 424B3 on 2019-12-23 - Score: 7 (Tier A)
    ✓ 8-K on 2019-12-23 - Score: 0 (Tier F)
    ✓ 8-K on 2019-12-03 - Score: 0 (Tier F)
    ✓ 8-K on 2019-11-26 - Score: 0 (Tier F)
    ✓ 424B3 on 2019-11-18 - Score: 6 (Tier A)
    ✓ 10-Q on 2019-11-14 - Score: 5 (Tier A)
    ✓ 424B3 on 2019-11-08 - Score: 6 (Tier A)
  ✓ Saved 10 scored filings to MongoDB

Processing: QUIK - Split: 1 : 14 on 12/24/2019
  Querying EDGAR (CIK: 0000882508) from 2019-06-27 to 2020-01-08
  Found 12 relevant filings
    ✓ 8-K on 2019-12-24 - Score: 8 (Tier A)
    ✓ 8-K on 2019-12-12 - Score: 6 (Tier A)
    ✓ 8-K on 2019-12-09 - Score: 7 (Tier A)
    ✓ 8-K on 2019-12-05 - Score: 4 (Tier B)
    ✓ 8-K on 2019-11-27 - Score: 6 (Tier A)
    ✓ 10-Q on 2019-11-08 - Score: 3 (Tier B)
    ✓ 8-K on 2019-11-06 - Score: 4 (Tier B)
    ✓ DEF 14A on 2019-10-17 - Score: 6 (Tier A)
    ✓ PRE 14A on 2019-10-07 - Score: 5 (Tier A)
    ✓ 10-Q on 2019-08-09 - Score: 3 (Tier B)
  ✓ Saved 10 scored filings to MongoDB

Processing: CEIN - Split: 1 : 25 on 12/24/2018
  Querying EDGAR (CIK: 0001309082) from 2018-06-27 to 2019-01-08
  Found 29 relevant filings
    ✓ PRE 14A on 2018-12-26 - Score: 9 (Tier A)
    ✓ 8-K on 2018-12-26 - Score: 8 (Tier A)
    ✓ 8-K on 2018-12-21 - Score: 8 (Tier A)
    ✓ 8-K on 2018-12-19 - Score: 6 (Tier A)
    ✓ 8-K on 2018-12-18 - Score: 0 (Tier F)
    ✓ 8-K on 2018-12-14 - Score: 4 (Tier B)
    ✓ 8-K on 2018-12-12 - Score: 4 (Tier B)
    ✓ 8-K on 2018-12-07 - Score: 6 (Tier A)
    ✓ 8-K on 2018-11-30 - Score: 0 (Tier F)
    ✓ 8-K on 2018-11-23 - Score: 5 (Tier A)
  ✓ Saved 10 scored filings to MongoDB

Processing: PIOIQ - Split: 1 : 5 on 12/24/2012
  ✗ No CIK found for PIOIQ (P10 Industries Inc)

Processing: ICCT - Split: 1 : 20 on 12/23/2024
  ✓ Found CIK via company name: 0000918541
  Querying EDGAR (CIK: 0000918541) from 2024-06-26 to 2025-01-07
  Found 10 relevant filings
    ✓ 8-K on 2025-01-02 - Score: 5 (Tier A)
    ✓ 8-K on 2024-12-19 - Score: 4 (Tier B)
    ✓ 8-K on 2024-12-02 - Score: 4 (Tier B)
    ✓ 8-K on 2024-11-04 - Score: 4 (Tier B)
    ✓ 8-K on 2024-10-31 - Score: 5 (Tier A)
    ✓ 10-Q on 2024-10-31 - Score: 2 (Tier C)
    ✓ 8-K on 2024-08-30 - Score: 5 (Tier A)
    ✓ 10-Q on 2024-08-07 - Score: 2 (Tier C)
    ✓ 8-K on 2024-08-07 - Score: 4 (Tier B)
    ✓ 8-K on 2024-07-03 - Score: 5 (Tier A)
  ✓ Saved 10 scored filings to MongoDB

Processing: BTCM - Split: 1 : 10 on 12/23/2022
  ✗ No CIK found for BTCM (Bit Mining Ltd.)

Processing: KALRQ - Split: 1 : 100 on 12/23/2022
  ✗ No CIK found for KALRQ (Kalera Public Ltd Co.)

Processing: ATLX - Split: 1 : 751.88 on 12/23/2022
  Querying EDGAR (CIK: 0001540684) from 2022-06-26 to 2023-01-07
  Found 7 relevant filings
    ✓ 8-K on 2022-12-22 - Score: 7 (Tier A)
    ✓ 10-Q on 2022-11-01 - Score: 2 (Tier C)
    ✓ 8-K on 2022-09-07 - Score: 0 (Tier F)
    ✓ 8-K on 2022-08-22 - Score: 0 (Tier F)
    ✓ 10-Q on 2022-08-12 - Score: 2 (Tier C)
    ✓ 8-K on 2022-07-22 - Score: 0 (Tier F)
    ✓ PRE 14C on 2022-07-18 - Score: 7 (Tier A)
  ✓ Saved 7 scored filings to MongoDB

Processing: HIND - Split: 1 : 50 on 12/23/2022
  Querying EDGAR (CIK: 0001427570) from 2022-06-26 to 2023-01-07
  Found 13 relevant filings
    ✓ 8-K on 2022-12-28 - Score: 8 (Tier A)
    ✓ 8-K on 2022-12-20 - Score: 7 (Tier A)
    ✓ 10-Q on 2022-11-14 - Score: 5 (Tier A)
    ✓ 8-K on 2022-11-14 - Score: 4 (Tier B)
    ✓ 8-K on 2022-11-14 - Score: 4 (Tier B)
    ✓ DEF 14A on 2022-11-10 - Score: 7 (Tier A)
    ✓ 424B5 on 2022-11-09 - Score: 4 (Tier B)
    ✓ PRE 14A on 2022-10-31 - Score: 7 (Tier A)
    ✓ 10-Q on 2022-08-19 - Score: 5 (Tier A)
    ✓ 8-K on 2022-08-16 - Score: 5 (Tier A)
  ✓ Saved 10 scored filings to MongoDB

Processing: VSA - Split: 1 : 5 on 12/23/2021
  Querying EDGAR (CIK: 0001592560) from 2021-06-26 to 2022-01-07
  Found 7 relevant filings
    ✓ 6-K on 2022-01-03 - Score: 0 (Tier F)
    ✓ 6-K on 2021-12-14 - Score: 0 (Tier F)
    ✓ 6-K on 2021-12-01 - Score: 0 (Tier F)
    ✓ 6-K on 2021-11-23 - Score: 0 (Tier F)
    ✓ 6-K on 2021-11-15 - Score: 0 (Tier F)
    ✓ 6-K on 2021-09-30 - Score: 0 (Tier F)
    ✓ 6-K on 2021-09-24 - Score: 0 (Tier F)
  ✓ Saved 7 scored filings to MongoDB

Processing: ZMENY - Split: 1 : 8 on 12/23/2021
  ✓ Found CIK via company name: 0001018963
  Querying EDGAR (CIK: 0001018963) from 2021-06-26 to 2022-01-07
  Found 13 relevant filings
    ✓ 10-Q on 2021-11-02 - Score: 2 (Tier C)
    ✓ 8-K on 2021-10-28 - Score: 0 (Tier F)
    ✓ 8-K on 2021-10-21 - Score: 0 (Tier F)
    ✓ 8-K on 2021-09-14 - Score: 0 (Tier F)
    ✓ 424B5 on 2021-09-10 - Score: 4 (Tier B)
    ✓ 8-K on 2021-09-10 - Score: 0 (Tier F)
    ✓ FWP on 2021-09-09 - Score: 0 (Tier F)
    ✓ 8-K on 2021-09-08 - Score: 0 (Tier F)
    ✓ 424B3 on 2021-09-08 - Score: 4 (Tier B)
    ✓ 8-K on 2021-08-16 - Score: 0 (Tier F)
  ✓ Saved 10 scored filings to MongoDB

Processing: HEXO - Split: 1 : 4 on 12/23/2020
  ✗ No CIK found for HEXO (Hexo Corp)

Processing: KANT - Split: 1 : 20 on 12/23/2020
  ✗ No CIK found for KANT (Kineta Inc)

Processing: NVFY - Split: 1 : 5 on 12/23/2019
  Querying EDGAR (CIK: 0001473334) from 2019-06-26 to 2020-01-07
  Found 5 relevant filings
    ✓ 8-K on 2019-12-20 - Score: 8 (Tier A)
    ✓ 10-Q on 2019-11-12 - Score: 3 (Tier B)
    ✓ 8-K on 2019-08-16 - Score: 5 (Tier A)
    ✓ 10-Q on 2019-08-14 - Score: 3 (Tier B)
    ✓ 8-K on 2019-07-22 - Score: 5 (Tier A)
  ✓ Saved 5 scored filings to MongoDB

Processing: PCSA - Split: 1 : 7 on 12/23/2019
  Querying EDGAR (CIK: 0001533743) from 2019-06-26 to 2020-01-07
  Found 9 relevant filings
    ✓ 8-K on 2019-12-20 - Score: 0 (Tier F)
    ✓ S-1 on 2019-12-13 - Score: 4 (Tier B)
    ✓ 10-Q on 2019-11-14 - Score: 4 (Tier B)
    ✓ PRE 14C on 2019-11-12 - Score: 3 (Tier B)
    ✓ 8-K on 2019-10-23 - Score: 0 (Tier F)
    ✓ 8-K on 2019-10-03 - Score: 0 (Tier F)
    ✓ 8-K on 2019-09-04 - Score: 6 (Tier A)
    ✓ 10-Q on 2019-08-14 - Score: 4 (Tier B)
    ✓ PRE 14C on 2019-07-02 - Score: 0 (Tier F)
  ✓ Saved 9 scored filings to MongoDB

Processing: NYNY - Split: 1 : 5 on 12/23/2015
  ✗ No CIK found for NYNY (Empire Resorts Inc)

Processing: ATRX - Split: 1 : 10 on 12/23/2011
  ✗ No CIK found for ATRX (Adhera Therapeutics Inc)

Processing: GMBL - Split: 1 : 400 on 12/22/2023
  Querying EDGAR (CIK: 0001451448) from 2023-06-25 to 2024-01-06
  Found 37 relevant filings
    ✓ 8-K on 2023-12-22 - Score: 7 (Tier A)
    ✓ 8-K on 2023-12-20 - Score: 4 (Tier B)
    ✓ 8-K on 2023-12-12 - Score: 5 (Tier A)
    ✓ 8-K on 2023-12-07 - Score: 4 (Tier B)
    ✓ 8-K on 2023-12-04 - Score: 4 (Tier B)
    ✓ 8-K on 2023-11-30 - Score: 5 (Tier A)
    ✓ 8-K on 2023-11-27 - Score: 4 (Tier B)
    ✓ 10-Q on 2023-11-20 - Score: 5 (Tier A)
    ✓ 8-K on 2023-11-13 - Score: 4 (Tier B)
    ✓ 8-K on 2023-11-07 - Score: 4 (Tier B)
  ✓ Saved 10 scored filings to MongoDB

Processing: OP - Split: 1 : 10 on 12/22/2022
  Querying EDGAR (CIK: 0001869467) from 2022-06-25 to 2023-01-06
  Found 11 relevant filings
    ✓ 6-K on 2022-12-22 - Score: 6 (Tier A)
    ✓ 6-K on 2022-12-19 - Score: 7 (Tier A)
    ✓ 424B5 on 2022-11-29 - Score: 4 (Tier B)
    ✓ 6-K on 2022-11-29 - Score: 4 (Tier B)
    ✓ 424B3 on 2022-09-30 - Score: 4 (Tier B)
    ✓ 6-K on 2022-09-29 - Score: 0 (Tier F)
    ✓ 6-K on 2022-09-22 - Score: 4 (Tier B)
    ✓ 6-K on 2022-09-07 - Score: 5 (Tier A)
    ✓ 6-K on 2022-08-02 - Score: 4 (Tier B)
    ✓ 424B3 on 2022-07-08 - Score: 2 (Tier C)
  ✓ Saved 10 scored filings to MongoDB

Processing: TISI - Split: 1 : 10 on 12/22/2022
  Querying EDGAR (CIK: 0000318833) from 2022-06-25 to 2023-01-06
  Found 20 relevant filings
    ✓ 8-K on 2022-12-22 - Score: 5 (Tier A)
    ✓ 8-K on 2022-12-09 - Score: 4 (Tier B)
    ✓ 8-K on 2022-11-29 - Score: 0 (Tier F)
    ✓ 8-K on 2022-11-22 - Score: 0 (Tier F)
    ✓ 8-K on 2022-11-10 - Score: 0 (Tier F)
    ✓ 8-K on 2022-11-09 - Score: 0 (Tier F)
    ✓ 10-Q on 2022-11-09 - Score: 3 (Tier B)
    ✓ 8-K on 2022-11-09 - Score: 0 (Tier F)
    ✓ 8-K on 2022-11-07 - Score: 5 (Tier A)
    ✓ 8-K on 2022-11-03 - Score: 0 (Tier F)
  ✓ Saved 10 scored filings to MongoDB

Processing: THMO - Split: 1 : 45 on 12/22/2022
  ✗ No CIK found for THMO (Thermogenesis Holdings Inc)

Processing: MARK - Split: 1 : 10 on 12/22/2022
  ✗ No CIK found for MARK (Remark Holdings Inc)

Processing: CENN - Split: 1 : 15 on 12/22/2021
  Querying EDGAR (CIK: 0001707919) from 2021-06-25 to 2022-01-06
  Found 21 relevant filings
    ✓ 6-K on 2022-01-05 - Score: 10 (Tier A)
    ✓ 6-K on 2022-01-03 - Score: 5 (Tier A)
    ✓ 6-K on 2021-12-21 - Score: 7 (Tier A)
    ✓ 6-K on 2021-12-14 - Score: 0 (Tier F)
    ✓ FWP on 2021-11-24 - Score: 3 (Tier B)
    ✓ 6-K on 2021-11-24 - Score: 0 (Tier F)
    ✓ 6-K on 2021-11-24 - Score: 0 (Tier F)
    ✓ 6-K on 2021-11-17 - Score: 4 (Tier B)
    ✓ FWP on 2021-11-09 - Score: 0 (Tier F)
    ✓ FWP on 2021-11-09 - Score: 2 (Tier C)
  ✓ Saved 10 scored filings to MongoDB

Processing: WPGGQ - Split: 1 : 9 on 12/22/2020
  ✗ No CIK found for WPGGQ (Washington Prime Group Inc)

Processing: WINT - Split: 1 : 20 on 12/22/2017
  Querying EDGAR (CIK: 0000946486) from 2017-06-25 to 2018-01-06
  Found 11 relevant filings
    ✓ 8-K on 2017-12-21 - Score: 5 (Tier A)
    ✓ PRE 14C on 2017-11-22 - Score: 7 (Tier A)
    ✓ 10-Q on 2017-11-14 - Score: 2 (Tier C)
    ✓ 8-K on 2017-11-01 - Score: 5 (Tier A)
    ✓ 8-K on 2017-10-10 - Score: 0 (Tier F)
    ✓ 8-K on 2017-09-11 - Score: 0 (Tier F)
    ✓ 10-Q on 2017-08-21 - Score: 3 (Tier B)
    ✓ 8-K on 2017-08-18 - Score: 4 (Tier B)
    ✓ 8-K on 2017-07-17 - Score: 0 (Tier F)
    ✓ 8-K on 2017-06-30 - Score: 0 (Tier F)
  ✓ Saved 10 scored filings to MongoDB

Processing: HRGN - Split: 1 : 20 on 12/22/2017
  Querying EDGAR (CIK: 0001563665) from 2017-06-25 to 2018-01-06
  Found 13 relevant filings
    ✓ 8-K on 2018-01-03 - Score: 0 (Tier F)
    ✓ 8-K on 2017-12-22 - Score: 6 (Tier A)
    ✓ 10-Q on 2017-12-15 - Score: 4 (Tier B)
    ✓ 8-K on 2017-12-14 - Score: 0 (Tier F)
    ✓ 8-K on 2017-12-07 - Score: 5 (Tier A)
    ✓ 8-K on 2017-10-12 - Score: 0 (Tier F)
    ✓ 8-K on 2017-10-06 - Score: 4 (Tier B)
    ✓ 8-K on 2017-08-17 - Score: 6 (Tier A)
    ✓ S-1 on 2017-08-15 - Score: 2 (Tier C)
    ✓ 10-Q on 2017-08-14 - Score: 4 (Tier B)
  ✓ Saved 10 scored filings to MongoDB

Processing: BNAUF - Split: 1 : 162.07 on 12/22/2016
  ✗ No CIK found for BNAUF (Battle North Gold Corp)

Processing: UNTKQ - Split: 1 : 2 on 12/22/2010
  ✓ Found CIK via company name: 0000798949
  Querying EDGAR (CIK: 0000798949) from 2010-06-25 to 2011-01-06
  Found 6 relevant filings
    ✓ 10-Q on 2010-11-04 - Score: 5 (Tier A)
    ✓ 8-K on 2010-11-04 - Score: 0 (Tier F)
    ✓ 10-Q on 2010-08-05 - Score: 5 (Tier A)
    ✓ 8-K on 2010-08-03 - Score: 0 (Tier F)
    ✓ 8-K on 2010-07-21 - Score: 0 (Tier F)
    ✓ 8-K on 2010-07-06 - Score: 0 (Tier F)
  ✓ Saved 6 scored filings to MongoDB

Processing: BINI - Split: 1 : 100 on 12/21/2023
  Querying EDGAR (CIK: 0001499961) from 2023-06-24 to 2024-01-05
  Found 32 relevant filings
    ✓ 8-K on 2023-12-29 - Score: 5 (Tier A)
    ✓ 8-K on 2023-12-26 - Score: 4 (Tier B)
    ✓ 8-K on 2023-12-22 - Score: 4 (Tier B)
    ✓ 8-K on 2023-12-21 - Score: 9 (Tier A)
    ✓ DEFA14A on 2023-12-15 - Score: 5 (Tier A)
    ✓ 8-K on 2023-12-08 - Score: 4 (Tier B)
    ✓ 8-K on 2023-12-06 - Score: 4 (Tier B)
    ✓ 8-K on 2023-12-01 - Score: 5 (Tier A)
    ✓ DEF 14A on 2023-11-08 - Score: 6 (Tier A)
    ✓ 8-K on 2023-11-02 - Score: 4 (Tier B)
  ✓ Saved 10 scored filings to MongoDB

Processing: BKYI - Split: 1 : 18 on 12/21/2023
  Querying EDGAR (CIK: 0001019034) from 2023-06-24 to 2024-01-05
  Found 14 relevant filings
    ✓ 8-K on 2023-12-21 - Score: 11 (Tier A)
    ✓ 8-K on 2023-12-19 - Score: 7 (Tier A)
    ✓ DEF 14A on 2023-11-24 - Score: 8 (Tier A)
    ✓ 10-Q on 2023-11-20 - Score: 3 (Tier B)
    ✓ PRE 14A on 2023-11-14 - Score: 6 (Tier A)
    ✓ 8-K on 2023-11-13 - Score: 6 (Tier A)
    ✓ 8-K on 2023-11-02 - Score: 4 (Tier B)
    ✓ 8-K on 2023-10-25 - Score: 4 (Tier B)
    ✓ S-1 on 2023-10-16 - Score: 4 (Tier B)
    ✓ 10-Q on 2023-08-18 - Score: 3 (Tier B)
  ✓ Saved 10 scored filings to MongoDB

Processing: MTVA - Split: 1 : 8 on 12/21/2023
  Querying EDGAR (CIK: 0001638287) from 2023-06-24 to 2024-01-05
  Found 18 relevant filings
    ✓ 8-K on 2023-12-28 - Score: 4 (Tier B)
    ✓ 8-K on 2023-12-19 - Score: 7 (Tier A)
    ✓ 8-K on 2023-12-07 - Score: 4 (Tier B)
    ✓ 10-Q on 2023-11-13 - Score: 5 (Tier A)
    ✓ 8-K on 2023-11-13 - Score: 4 (Tier B)
    ✓ 8-K on 2023-11-06 - Score: 5 (Tier A)
    ✓ 8-K on 2023-10-30 - Score: 5 (Tier A)
    ✓ 8-K on 2023-09-22 - Score: 4 (Tier B)
    ✓ 8-K on 2023-09-19 - Score: 5 (Tier A)
    ✓ 8-K on 2023-09-15 - Score: 4 (Tier B)
  ✓ Saved 10 scored filings to MongoDB

Processing: HTGMQ - Split: 1 : 12 on 12/21/2022
  ✗ No CIK found for HTGMQ (Htg Molecular Diagnostics Inc)

Processing: CEIN - Split: 1 : 50 on 12/21/2022
  Querying EDGAR (CIK: 0001309082) from 2022-06-24 to 2023-01-05
  Found 18 relevant filings
    ✓ 8-K on 2023-01-05 - Score: 0 (Tier F)
    ✓ 8-K on 2023-01-04 - Score: 5 (Tier A)
    ✓ 8-K on 2022-12-27 - Score: 5 (Tier A)
    ✓ 8-K on 2022-12-21 - Score: 10 (Tier A)
    ✓ 8-K on 2022-12-15 - Score: 6 (Tier A)
    ✓ 10-Q on 2022-11-14 - Score: 5 (Tier A)
    ✓ 8-K on 2022-11-14 - Score: 5 (Tier A)
    ✓ 8-K on 2022-11-04 - Score: 5 (Tier A)
    ✓ 8-K on 2022-11-01 - Score: 5 (Tier A)
    ✓ 8-K on 2022-10-03 - Score: 5 (Tier A)
  ✓ Saved 10 scored filings to MongoDB

Processing: NBY - Split: 1 : 25 on 12/21/2015
  Querying EDGAR (CIK: 0001389545) from 2015-06-24 to 2016-01-05
  Found 19 relevant filings
    ✓ 8-K on 2016-01-05 - Score: 5 (Tier A)
    ✓ 8-K on 2015-12-21 - Score: 7 (Tier A)
    ✓ 8-K on 2015-12-14 - Score: 6 (Tier A)
    ✓ DEF 14A on 2015-11-20 - Score: 6 (Tier A)
    ✓ 8-K on 2015-11-19 - Score: 4 (Tier B)
    ✓ 10-Q on 2015-11-16 - Score: 5 (Tier A)
    ✓ PRE 14A on 2015-11-06 - Score: 6 (Tier A)
    ✓ 8-K on 2015-10-27 - Score: 0 (Tier F)
    ✓ 424B5 on 2015-10-26 - Score: 5 (Tier A)
    ✓ 424B5 on 2015-10-23 - Score: 5 (Tier A)
  ✓ Saved 10 scored filings to MongoDB

Processing: NSPR - Split: 1 : 4 on 12/21/2012
  Querying EDGAR (CIK: 0001433607) from 2012-06-24 to 2013-01-05
  Found 21 relevant filings
    ✓ 8-K on 2012-12-26 - Score: 0 (Tier F)
    ✓ 8-K on 2012-12-21 - Score: 4 (Tier B)
    ✓ 8-K on 2012-12-04 - Score: 0 (Tier F)
    ✓ 8-K on 2012-11-16 - Score: 0 (Tier F)
    ✓ DEF 14A on 2012-11-09 - Score: 7 (Tier A)
    ✓ 8-K on 2012-11-05 - Score: 0 (Tier F)
    ✓ 8-K on 2012-11-05 - Score: 0 (Tier F)
    ✓ 10-Q on 2012-11-02 - Score: 3 (Tier B)
    ✓ 8-K on 2012-10-24 - Score: 5 (Tier A)
    ✓ 8-K on 2012-10-23 - Score: 0 (Tier F)
  ✓ Saved 10 scored filings to MongoDB

Processing: DQ - Split: 1 : 5 on 12/21/2012
  Querying EDGAR (CIK: 0001477641) from 2012-06-24 to 2013-01-05
  Found 8 relevant filings
    ✓ 6-K on 2012-12-27 - Score: 0 (Tier F)
    ✓ 6-K on 2012-12-14 - Score: 0 (Tier F)
    ✓ 6-K on 2012-11-30 - Score: 0 (Tier F)
    ✓ 6-K on 2012-10-30 - Score: 0 (Tier F)
    ✓ 6-K on 2012-10-18 - Score: 0 (Tier F)
    ✓ 6-K on 2012-08-22 - Score: 0 (Tier F)
    ✓ 6-K on 2012-08-17 - Score: 0 (Tier F)
    ✓ 6-K on 2012-07-10 - Score: 0 (Tier F)
  ✓ Saved 8 scored filings to MongoDB

Processing: CSUNY - Split: 1 : 3 on 12/21/2011
  ✗ No CIK found for CSUNY (China Sunergy Co Ltd.)

Processing: EXPE - Split: 1 : 2 on 12/21/2011
  Querying EDGAR (CIK: 0001324424) from 2011-06-24 to 2012-01-05
  Found 0 relevant filings
  ⚠ Historical split: SEC API only returns filings from 2015-12-17 onwards (split date: 12/21/2011)
     Date window: [2011-06-24 to 2012-01-05]
     Total filings available for CIK: 1007
     Filing date range available: 2015-12-17 to 2025-11-14

Processing: CCGM - Split: 1 : 4 on 12/21/2010
  ✗ No CIK found for CCGM (China Cgame Inc)

Progress: 100/1000 splits processed

Processing: BBLG - Split: 1 : 8 on 12/20/2023
  Querying EDGAR (CIK: 0001419554) from 2023-06-23 to 2024-01-04
  Found 15 relevant filings
    ✓ 8-K on 2024-01-02 - Score: 5 (Tier A)
    ✓ 8-K on 2023-12-18 - Score: 8 (Tier A)
    ✓ 8-K on 2023-12-13 - Score: 7 (Tier A)
    ✓ 8-K on 2023-11-20 - Score: 5 (Tier A)
    ✓ 424B5 on 2023-11-20 - Score: 6 (Tier A)
    ✓ DEF 14A on 2023-11-20 - Score: 6 (Tier A)
    ✓ 10-Q on 2023-11-14 - Score: 5 (Tier A)
    ✓ PRE 14A on 2023-11-09 - Score: 6 (Tier A)
    ✓ 8-K on 2023-10-24 - Score: 5 (Tier A)
    ✓ 8-K on 2023-09-29 - Score: 5 (Tier A)
  ✓ Saved 10 scored filings to MongoDB

Processing: SCOR - Split: 1 : 20 on 12/20/2023
  Querying EDGAR (CIK: 0001158172) from 2023-06-23 to 2024-01-04
  Found 12 relevant filings
    ✓ DEFA14A on 2023-12-29 - Score: 4 (Tier B)
    ✓ 8-K on 2023-12-29 - Score: 5 (Tier A)
    ✓ 8-K on 2023-12-27 - Score: 7 (Tier A)
    ✓ 8-K on 2023-12-18 - Score: 7 (Tier A)
    ✓ 10-Q on 2023-11-08 - Score: 4 (Tier B)
    ✓ 8-K on 2023-11-06 - Score: 0 (Tier F)
    ✓ DEFA14A on 2023-10-31 - Score: 0 (Tier F)
    ✓ DEF 14A on 2023-10-31 - Score: 6 (Tier A)
    ✓ PRE 14A on 2023-10-18 - Score: 6 (Tier A)
    ✓ 10-Q on 2023-08-09 - Score: 1 (Tier C)
  ✓ Saved 10 scored filings to MongoDB

Processing: CGC - Split: 1 : 10 on 12/20/2023
  Querying EDGAR (CIK: 0001737927) from 2023-06-23 to 2024-01-04
  Found 48 relevant filings
    ✓ 424B3 on 2024-01-02 - Score: 2 (Tier C)
    ✓ 8-K on 2024-01-02 - Score: 5 (Tier A)
    ✓ 424B3 on 2023-12-18 - Score: 5 (Tier A)
    ✓ 8-K on 2023-12-18 - Score: 7 (Tier A)
    ✓ 424B3 on 2023-11-13 - Score: 6 (Tier A)
    ✓ 424B3 on 2023-11-13 - Score: 6 (Tier A)
    ✓ 424B3 on 2023-11-13 - Score: 6 (Tier A)
    ✓ 8-K on 2023-11-09 - Score: 4 (Tier B)
    ✓ 10-Q on 2023-11-09 - Score: 5 (Tier A)
    ✓ 424B3 on 2023-11-01 - Score: 2 (Tier C)
  ✓ Saved 10 scored filings to MongoDB

Processing: WNW - Split: 1 : 35 on 12/20/2023
  Querying EDGAR (CIK: 0001787803) from 2023-06-23 to 2024-01-04
  Found 2 relevant filings
    ✓ 6-K on 2023-12-29 - Score: 0 (Tier F)
    ✓ 6-K on 2023-08-11 - Score: 5 (Tier A)
  ✓ Saved 2 scored filings to MongoDB

Processing: SIDU - Split: 1 : 100 on 12/20/2023
  Querying EDGAR (CIK: 0001879726) from 2023-06-23 to 2024-01-04
  Found 18 relevant filings
    ✓ S-1 on 2023-12-27 - Score: 6 (Tier A)
    ✓ 8-K on 2023-12-19 - Score: 7 (Tier A)
    ✓ 8-K on 2023-12-06 - Score: 5 (Tier A)
    ✓ 8-K on 2023-11-15 - Score: 5 (Tier A)
    ✓ 10-Q on 2023-11-14 - Score: 3 (Tier B)
    ✓ PRE 14C on 2023-11-13 - Score: 7 (Tier A)
    ✓ 8-K on 2023-11-13 - Score: 5 (Tier A)
    ✓ 8-K on 2023-10-30 - Score: 5 (Tier A)
    ✓ 8-K on 2023-10-13 - Score: 5 (Tier A)
    ✓ 424B5 on 2023-10-13 - Score: 2 (Tier C)
  ✓ Saved 10 scored filings to MongoDB

Processing: SINT - Split: 1 : 100 on 12/20/2022
  Querying EDGAR (CIK: 0001269026) from 2022-06-23 to 2023-01-04
  Found 16 relevant filings
    ✓ 8-K on 2022-12-19 - Score: 6 (Tier A)
    ✓ 8-K on 2022-12-16 - Score: 7 (Tier A)
    ✓ 8-K on 2022-11-23 - Score: 5 (Tier A)
    ✓ 10-Q on 2022-11-14 - Score: 4 (Tier B)
    ✓ DEF 14A on 2022-11-04 - Score: 6 (Tier A)
    ✓ 8-K on 2022-10-31 - Score: 6 (Tier A)
    ✓ PRE 14A on 2022-10-25 - Score: 6 (Tier A)
    ✓ 8-K on 2022-10-18 - Score: 5 (Tier A)
    ✓ 424B3 on 2022-10-13 - Score: 0 (Tier F)
    ✓ 424B3 on 2022-09-23 - Score: 5 (Tier A)
  ✓ Saved 10 scored filings to MongoDB

Processing: MDWD - Split: 1 : 7 on 12/20/2022
  Querying EDGAR (CIK: 0001593984) from 2022-06-23 to 2023-01-04
  Found 21 relevant filings
    ✓ 6-K on 2022-12-29 - Score: 0 (Tier F)
    ✓ 6-K on 2022-12-23 - Score: 0 (Tier F)
    ✓ 6-K on 2022-12-20 - Score: 7 (Tier A)
    ✓ 6-K on 2022-12-19 - Score: 0 (Tier F)
    ✓ 6-K on 2022-12-05 - Score: 9 (Tier A)
    ✓ 6-K on 2022-11-28 - Score: 0 (Tier F)
    ✓ 424B3 on 2022-11-25 - Score: 6 (Tier A)
    ✓ 6-K on 2022-11-15 - Score: 0 (Tier F)
    ✓ 6-K on 2022-11-09 - Score: 0 (Tier F)
    ✓ 6-K on 2022-10-21 - Score: 0 (Tier F)
  ✓ Saved 10 scored filings to MongoDB

Processing: ANFIF - Split: 1 : 20 on 12/20/2019
  ✗ No CIK found for ANFIF (Amira Nature Foods Ltd.)

Processing: PLX - Split: 1 : 10 on 12/20/2019
  Querying EDGAR (CIK: 0001006281) from 2019-06-23 to 2020-01-04
  Found 19 relevant filings
    ✓ 8-K on 2019-12-20 - Score: 8 (Tier A)
    ✓ 8-K on 2019-12-19 - Score: 5 (Tier A)
    ✓ 8-K on 2019-12-09 - Score: 7 (Tier A)
    ✓ DEFA14A on 2019-11-26 - Score: 0 (Tier F)
    ✓ 8-K on 2019-11-18 - Score: 4 (Tier B)
    ✓ DEFA14A on 2019-11-15 - Score: 0 (Tier F)
    ✓ DEFA14A on 2019-11-12 - Score: 0 (Tier F)
    ✓ 10-Q on 2019-11-07 - Score: 3 (Tier B)
    ✓ 8-K on 2019-11-07 - Score: 4 (Tier B)
    ✓ 8-K on 2019-10-17 - Score: 4 (Tier B)
  ✓ Saved 10 scored filings to MongoDB

Processing: SPNX - Split: 1 : 10 on 12/20/2019
  ✗ No CIK found for SPNX (Superior Energy Services Inc)

Processing: CENN - Split: 1 : 100 on 12/20/2019
  Querying EDGAR (CIK: 0001707919) from 2019-06-23 to 2020-01-04
  Found 26 relevant filings
    ✓ 6-K on 2020-01-03 - Score: 6 (Tier A)
    ✓ 6-K on 2019-12-20 - Score: 0 (Tier F)
    ✓ 6-K on 2019-12-20 - Score: 6 (Tier A)
    ✓ 6-K on 2019-12-19 - Score: 4 (Tier B)
    ✓ 6-K on 2019-12-16 - Score: 4 (Tier B)
    ✓ 6-K on 2019-12-16 - Score: 8 (Tier A)
    ✓ 6-K on 2019-12-12 - Score: 4 (Tier B)
    ✓ 6-K on 2019-12-06 - Score: 4 (Tier B)
    ✓ 6-K on 2019-12-03 - Score: 4 (Tier B)
    ✓ 6-K on 2019-11-15 - Score: 0 (Tier F)
  ✓ Saved 10 scored filings to MongoDB

Processing: PMTS - Split: 1 : 5 on 12/20/2017
  Querying EDGAR (CIK: 0001641614) from 2017-06-23 to 2018-01-04
  Found 8 relevant filings
    ✓ 8-K on 2017-12-22 - Score: 8 (Tier A)
    ✓ 10-Q on 2017-11-08 - Score: 2 (Tier C)
    ✓ 8-K on 2017-11-07 - Score: 0 (Tier F)
    ✓ PRE 14C on 2017-10-10 - Score: 7 (Tier A)
    ✓ 8-K on 2017-09-29 - Score: 6 (Tier A)
    ✓ 10-Q on 2017-08-03 - Score: 0 (Tier F)
    ✓ 8-K on 2017-08-02 - Score: 0 (Tier F)
    ✓ 8-K on 2017-06-26 - Score: 0 (Tier F)
  ✓ Saved 8 scored filings to MongoDB

Processing: ELOX - Split: 1 : 20 on 12/20/2017
  ✗ No CIK found for ELOX (Eloxx Pharmaceuticals Inc)

Processing: HRZL - Split: 1 : 25 on 12/20/2011
  ✗ No CIK found for HRZL (Horizon Lines Inc)

Processing: AMZGQ - Split: 1 : 4.5 on 12/20/2011
  ✗ No CIK found for AMZGQ (American Eagle Energy Corp)

Processing: TFFP - Split: 1 : 25 on 12/19/2023
  ✗ No CIK found for TFFP (Tff Pharmaceuticals Inc)

Processing: NGNE - Split: 1 : 4 on 12/19/2023
  Querying EDGAR (CIK: 0001404644) from 2023-06-22 to 2024-01-03
  Found 7 relevant filings
    ✓ 8-K on 2023-12-19 - Score: 9 (Tier A)
    ✓ 8-K on 2023-12-06 - Score: 7 (Tier A)
    ✓ 8-K on 2023-12-04 - Score: 5 (Tier A)
    ✓ 10-Q on 2023-11-14 - Score: 3 (Tier B)
    ✓ 8-K on 2023-09-22 - Score: 6 (Tier A)
    ✓ 10-Q on 2023-08-10 - Score: 5 (Tier A)
    ✓ 8-K on 2023-07-18 - Score: 8 (Tier A)
  ✓ Saved 7 scored filings to MongoDB

Processing: HEXO - Split: 1 : 14 on 12/19/2022
  ✗ No CIK found for HEXO (Hexo Corp)

Processing: KANT - Split: 1 : 7 on 12/19/2022
  ✗ No CIK found for KANT (Kineta Inc)

Processing: ETHZ - Split: 1 : 20 on 12/19/2022
  Querying EDGAR (CIK: 0001690080) from 2022-06-22 to 2023-01-03
  Found 19 relevant filings
    ✓ 8-K on 2022-12-29 - Score: 5 (Tier A)
    ✓ 8-K on 2022-12-29 - Score: 4 (Tier B)
    ✓ 8-K on 2022-12-22 - Score: 6 (Tier A)
    ✓ 424B5 on 2022-12-22 - Score: 2 (Tier C)
    ✓ 8-K on 2022-12-16 - Score: 10 (Tier A)
    ✓ 8-K on 2022-11-30 - Score: 4 (Tier B)
    ✓ DEF 14A on 2022-11-16 - Score: 3 (Tier B)
    ✓ 8-K on 2022-11-15 - Score: 4 (Tier B)
    ✓ 10-Q on 2022-11-10 - Score: 5 (Tier A)
    ✓ PRE 14A on 2022-11-04 - Score: 3 (Tier B)
  ✓ Saved 10 scored filings to MongoDB

Processing: ASNAQ - Split: 1 : 20 on 12/19/2019
  ✗ No CIK found for ASNAQ (Mahwah Bergen Retail Group Inc)

Processing: ESEA - Split: 1 : 8 on 12/19/2019
  Querying EDGAR (CIK: 0001341170) from 2019-06-22 to 2020-01-03
  Found 11 relevant filings
    ✓ 6-K on 2019-12-19 - Score: 7 (Tier A)
    ✓ 6-K on 2019-12-10 - Score: 7 (Tier A)
    ✓ 6-K on 2019-11-25 - Score: 7 (Tier A)
    ✓ 6-K on 2019-11-22 - Score: 0 (Tier F)
    ✓ 6-K on 2019-11-21 - Score: 6 (Tier A)
    ✓ 6-K on 2019-11-19 - Score: 4 (Tier B)
    ✓ 6-K on 2019-09-30 - Score: 4 (Tier B)
    ✓ 6-K on 2019-09-17 - Score: 7 (Tier A)
    ✓ 6-K on 2019-08-23 - Score: 4 (Tier B)
    ✓ 6-K on 2019-08-09 - Score: 5 (Tier A)
  ✓ Saved 10 scored filings to MongoDB

Processing: EPSN - Split: 1 : 2 on 12/19/2018
  Querying EDGAR (CIK: 0001726126) from 2018-06-22 to 2019-01-03
  Found 0 relevant filings
  ⚠ No filings in date window
     Date window: [2018-06-22 to 2019-01-03]
     Total filings available for CIK: 261
     Filing date range available: 2018-02-12 to 2025-11-14
     Forms in date window (not matching target forms): {'10-12B': 1, 'DRS/A': 1, 'DRS': 1, 'RW': 1}

Processing: LMST - Split: 1 : 5 on 12/19/2016
  ✗ No CIK found for LMST (Limestone Bancorp Inc)

Processing: NVLNF - Split: 1 : 5 on 12/19/2016
  ✓ Found CIK via company name: 0001021860
  Querying EDGAR (CIK: 0001021860) from 2016-06-22 to 2017-01-03
  Found 5 relevant filings
    ✓ 8-K on 2016-11-09 - Score: 0 (Tier F)
    ✓ 10-Q on 2016-10-28 - Score: 2 (Tier C)
    ✓ 8-K on 2016-10-27 - Score: 0 (Tier F)
    ✓ 10-Q on 2016-08-03 - Score: 2 (Tier C)
    ✓ 8-K on 2016-07-28 - Score: 0 (Tier F)
  ✓ Saved 5 scored filings to MongoDB

Processing: LITS - Split: 1 : 6 on 12/19/2012
  Querying EDGAR (CIK: 0001262104) from 2012-06-22 to 2013-01-03
  Found 26 relevant filings
    ✓ 424B3 on 2012-12-19 - Score: 7 (Tier A)
    ✓ 8-K on 2012-12-19 - Score: 8 (Tier A)
    ✓ 424B3 on 2012-12-17 - Score: 5 (Tier A)
    ✓ 8-K on 2012-12-07 - Score: 0 (Tier F)
    ✓ 424B3 on 2012-11-21 - Score: 6 (Tier A)
    ✓ 8-K on 2012-11-21 - Score: 7 (Tier A)
    ✓ 424B3 on 2012-11-13 - Score: 6 (Tier A)
    ✓ 10-Q on 2012-11-13 - Score: 5 (Tier A)
    ✓ PRE 14C on 2012-11-09 - Score: 6 (Tier A)
    ✓ 424B3 on 2012-11-07 - Score: 2 (Tier C)
  ✓ Saved 10 scored filings to MongoDB

Processing: DYNT - Split: 1 : 5 on 12/19/2012
  Querying EDGAR (CIK: 0000720875) from 2012-06-22 to 2013-01-03
  Found 7 relevant filings
    ✓ 8-K on 2012-12-18 - Score: 6 (Tier A)
    ✓ 8-K on 2012-11-14 - Score: 0 (Tier F)
    ✓ 10-Q on 2012-11-14 - Score: 6 (Tier A)
    ✓ DEF 14A on 2012-10-30 - Score: 8 (Tier A)
    ✓ 8-K on 2012-10-30 - Score: 0 (Tier F)
    ✓ PRE 14A on 2012-10-15 - Score: 8 (Tier A)
    ✓ 10-K on 2012-09-28 - Score: 3 (Tier B)
  ✓ Saved 7 scored filings to MongoDB

Processing: MTC - Split: 1 : 8 on 12/18/2024
  Querying EDGAR (CIK: 0001742518) from 2024-06-21 to 2025-01-02
  Found 4 relevant filings
    ✓ 6-K on 2024-12-27 - Score: 0 (Tier F)
    ✓ 6-K on 2024-12-13 - Score: 0 (Tier F)
    ✓ 6-K on 2024-12-12 - Score: 9 (Tier A)
    ✓ 6-K on 2024-07-10 - Score: 0 (Tier F)
  ✓ Saved 4 scored filings to MongoDB

Processing: ENTO - Split: 1 : 20 on 12/18/2023
  Querying EDGAR (CIK: 0001604191) from 2023-06-21 to 2024-01-02
  Found 20 relevant filings
    ✓ 8-K on 2023-12-27 - Score: 4 (Tier B)
    ✓ 8-K on 2023-12-27 - Score: 4 (Tier B)
    ✓ 8-K on 2023-12-18 - Score: 4 (Tier B)
    ✓ 8-K on 2023-12-14 - Score: 7 (Tier A)
    ✓ DEF 14A on 2023-11-13 - Score: 5 (Tier A)
    ✓ 10-Q on 2023-11-13 - Score: 5 (Tier A)
    ✓ S-1 on 2023-11-03 - Score: 5 (Tier A)
    ✓ 8-K on 2023-10-31 - Score: 4 (Tier B)
    ✓ PRE 14A on 2023-10-12 - Score: 5 (Tier A)
    ✓ 424B3 on 2023-10-02 - Score: 5 (Tier A)
  ✓ Saved 10 scored filings to MongoDB

Processing: YQ - Split: 1 : 5 on 12/18/2023
  Querying EDGAR (CIK: 0001821468) from 2023-06-21 to 2024-01-02
  Found 5 relevant filings
    ✓ 6-K on 2023-12-13 - Score: 0 (Tier F)
    ✓ 6-K on 2023-12-07 - Score: 0 (Tier F)
    ✓ 6-K on 2023-09-22 - Score: 0 (Tier F)
    ✓ 6-K on 2023-08-29 - Score: 0 (Tier F)
    ✓ 6-K on 2023-08-10 - Score: 4 (Tier B)
  ✓ Saved 5 scored filings to MongoDB

Processing: VRAX - Split: 1 : 10 on 12/18/2023
  Querying EDGAR (CIK: 0001885827) from 2023-06-21 to 2024-01-02
  Found 15 relevant filings
    ✓ 6-K on 2023-12-21 - Score: 0 (Tier F)
    ✓ 424B3 on 2023-12-20 - Score: 8 (Tier A)
    ✓ 6-K on 2023-12-20 - Score: 8 (Tier A)
    ✓ 424B3 on 2023-12-20 - Score: 2 (Tier C)
    ✓ 6-K on 2023-12-18 - Score: 0 (Tier F)
    ✓ 6-K on 2023-12-14 - Score: 7 (Tier A)
    ✓ 6-K on 2023-12-08 - Score: 0 (Tier F)
    ✓ 6-K on 2023-11-08 - Score: 0 (Tier F)
    ✓ 6-K on 2023-10-31 - Score: 0 (Tier F)
    ✓ 6-K on 2023-10-12 - Score: 0 (Tier F)
  ✓ Saved 10 scored filings to MongoDB

Processing: BGMS - Split: 1 : 15 on 12/18/2023
  Querying EDGAR (CIK: 0001130166) from 2023-06-21 to 2024-01-02
  Found 15 relevant filings
    ✓ 8-K on 2023-12-26 - Score: 7 (Tier A)
    ✓ 424B5 on 2023-12-26 - Score: 5 (Tier A)
    ✓ 8-K on 2023-12-12 - Score: 6 (Tier A)
    ✓ 10-Q on 2023-11-29 - Score: 5 (Tier A)
    ✓ 8-K on 2023-11-28 - Score: 5 (Tier A)
    ✓ 8-K on 2023-11-15 - Score: 5 (Tier A)
    ✓ DEF 14A on 2023-11-14 - Score: 5 (Tier A)
    ✓ 8-K on 2023-11-13 - Score: 6 (Tier A)
    ✓ 8-K on 2023-11-07 - Score: 5 (Tier A)
    ✓ PRE 14A on 2023-11-02 - Score: 6 (Tier A)
  ✓ Saved 10 scored filings to MongoDB

Processing: VER - Split: 1 : 5 on 12/18/2020
  ✗ No CIK found for VER (Vereit Inc)

Processing: XXII - Split: 1 : 134.95 on 12/17/2024
  Querying EDGAR (CIK: 0001347858) from 2024-06-20 to 2025-01-01
  Found 29 relevant filings
    ✓ 8-K on 2024-12-17 - Score: 7 (Tier A)
    ✓ 8-K on 2024-12-06 - Score: 6 (Tier A)
    ✓ 10-Q on 2024-11-12 - Score: 5 (Tier A)
    ✓ 8-K on 2024-11-12 - Score: 0 (Tier F)
    ✓ 424B3 on 2024-11-08 - Score: 5 (Tier A)
    ✓ S-3 on 2024-11-01 - Score: 5 (Tier A)
    ✓ DEF 14A on 2024-10-25 - Score: 6 (Tier A)
    ✓ 8-K on 2024-10-24 - Score: 5 (Tier A)
    ✓ PRE 14A on 2024-10-15 - Score: 6 (Tier A)
    ✓ 424B5 on 2024-10-15 - Score: 5 (Tier A)
  ✓ Saved 10 scored filings to MongoDB

Processing: TCBP - Split: 1 : 10 on 12/17/2021
  ✓ Found CIK via company name: 0001872812
  Querying EDGAR (CIK: 0001872812) from 2021-06-20 to 2022-01-01
  Found 0 relevant filings
  ⚠ No filings in date window
     Date window: [2021-06-20 to 2022-01-01]
     Total filings available for CIK: 196
     Filing date range available: 2021-07-26 to 2025-10-07
     Forms in date window (not matching target forms): {'CORRESP': 4, 'F-1/A': 2, 'UPLOAD': 3, 'F-1': 1, 'DRSLTR': 2, 'DRS/A': 1, 'DRS': 1}

Processing: ROII - Split: 1 : 5 on 12/17/2020
  ✓ Found CIK via company name: 0001018963
  Querying EDGAR (CIK: 0001018963) from 2020-06-20 to 2021-01-01
  Found 7 relevant filings
    ✓ 8-K on 2020-12-04 - Score: 5 (Tier A)
    ✓ 8-K on 2020-11-24 - Score: 0 (Tier F)
    ✓ 10-Q on 2020-10-29 - Score: 2 (Tier C)
    ✓ 8-K on 2020-10-29 - Score: 0 (Tier F)
    ✓ 10-Q on 2020-08-04 - Score: 4 (Tier B)
    ✓ 8-K on 2020-08-04 - Score: 0 (Tier F)
    ✓ 8-K on 2020-06-22 - Score: 0 (Tier F)
  ✓ Saved 7 scored filings to MongoDB

Processing: GIGAQ - Split: 1 : 15 on 12/17/2019
  ✓ Found CIK via company name: 0001956744
  Querying EDGAR (CIK: 0001956744) from 2019-06-20 to 2020-01-01
  Found 0 relevant filings
  ⚠ Historical split: SEC API only returns filings from 2022-12-14 onwards (split date: 12/17/2019)
     Date window: [2019-06-20 to 2020-01-01]
     Total filings available for CIK: 185
     Filing date range available: 2022-12-14 to 2025-11-12

Processing: MTA - Split: 1 : 4 on 12/17/2019
  Querying EDGAR (CIK: 0001722606) from 2019-06-20 to 2020-01-01
  Found 16 relevant filings
    ✓ 6-K on 2019-12-18 - Score: 0 (Tier F)
    ✓ 6-K on 2019-12-17 - Score: 0 (Tier F)
    ✓ 6-K on 2019-12-10 - Score: 0 (Tier F)
    ✓ 6-K on 2019-11-27 - Score: 0 (Tier F)
    ✓ 6-K on 2019-11-08 - Score: 0 (Tier F)
    ✓ 6-K on 2019-10-25 - Score: 0 (Tier F)
    ✓ 6-K on 2019-10-25 - Score: 0 (Tier F)
    ✓ 6-K on 2019-10-01 - Score: 0 (Tier F)
    ✓ 6-K on 2019-09-30 - Score: 0 (Tier F)
    ✓ 6-K on 2019-09-27 - Score: 0 (Tier F)
  ✓ Saved 10 scored filings to MongoDB

Processing: PLG - Split: 1 : 10 on 12/17/2018
  Querying EDGAR (CIK: 0001095052) from 2018-06-20 to 2019-01-01
  Found 15 relevant filings
    ✓ 6-K on 2018-12-14 - Score: 0 (Tier F)
    ✓ 6-K on 2018-12-13 - Score: 0 (Tier F)
    ✓ 6-K on 2018-11-30 - Score: 0 (Tier F)
    ✓ 20-F on 2018-11-30 - Score: 6 (Tier A)
    ✓ 6-K on 2018-11-20 - Score: 0 (Tier F)
    ✓ 6-K on 2018-11-19 - Score: 5 (Tier A)
    ✓ 6-K on 2018-10-29 - Score: 0 (Tier F)
    ✓ 6-K on 2018-10-25 - Score: 0 (Tier F)
    ✓ 6-K on 2018-10-10 - Score: 0 (Tier F)
    ✓ 6-K on 2018-09-20 - Score: 0 (Tier F)
  ✓ Saved 10 scored filings to MongoDB

Processing: DXF - Split: 1 : 4 on 12/17/2014
  Querying EDGAR (CIK: 0001499494) from 2014-06-20 to 2015-01-01
  Found 6 relevant filings
    ✓ 6-K on 2014-12-29 - Score: 0 (Tier F)
    ✓ 6-K on 2014-12-09 - Score: 0 (Tier F)
    ✓ 6-K on 2014-12-01 - Score: 0 (Tier F)
    ✓ 6-K on 2014-11-18 - Score: 0 (Tier F)
    ✓ 6-K on 2014-09-11 - Score: 0 (Tier F)
    ✓ 6-K on 2014-07-22 - Score: 0 (Tier F)
  ✓ Saved 6 scored filings to MongoDB

Processing: CREX - Split: 1 : 5 on 12/17/2012
  Querying EDGAR (CIK: 0001356093) from 2012-06-20 to 2013-01-01
  Found 12 relevant filings
    ✓ 8-K on 2012-12-18 - Score: 0 (Tier F)
    ✓ 8-K on 2012-11-30 - Score: 5 (Tier A)
    ✓ 10-Q on 2012-11-09 - Score: 2 (Tier C)
    ✓ 8-K on 2012-11-08 - Score: 0 (Tier F)
    ✓ 8-K on 2012-10-09 - Score: 0 (Tier F)
    ✓ 8-K on 2012-10-05 - Score: 5 (Tier A)
    ✓ 8-K on 2012-09-18 - Score: 0 (Tier F)
    ✓ 424B5 on 2012-09-13 - Score: 2 (Tier C)
    ✓ 8-K on 2012-09-13 - Score: 0 (Tier F)
    ✓ 10-Q on 2012-08-10 - Score: 2 (Tier C)
  ✓ Saved 10 scored filings to MongoDB

Processing: ACER - Split: 1 : 4 on 12/17/2012
  ✗ No CIK found for ACER (Acer Therapeutics Inc)

Processing: COSM - Split: 1 : 25 on 12/16/2022
  Querying EDGAR (CIK: 0001474167) from 2022-06-19 to 2022-12-31
  Found 19 relevant filings
    ✓ 424B5 on 2022-12-21 - Score: 7 (Tier A)
    ✓ 8-K on 2022-12-20 - Score: 4 (Tier B)
    ✓ 424B3 on 2022-12-20 - Score: 4 (Tier B)
    ✓ 8-K on 2022-12-19 - Score: 8 (Tier A)
    ✓ 8-K on 2022-12-05 - Score: 5 (Tier A)
    ✓ 8-K on 2022-11-16 - Score: 5 (Tier A)
    ✓ 10-Q on 2022-11-14 - Score: 5 (Tier A)
    ✓ DEF 14A on 2022-10-20 - Score: 7 (Tier A)
    ✓ 424B3 on 2022-10-20 - Score: 4 (Tier B)
    ✓ 8-K on 2022-10-18 - Score: 6 (Tier A)
  ✓ Saved 10 scored filings to MongoDB

Processing: NHIQ - Split: 1 : 15 on 12/16/2022
  ✗ No CIK found for NHIQ (Nanthealth Inc)

Processing: BBLNF - Split: 1 : 25 on 12/16/2022
  ✗ No CIK found for BBLNF (Babylon Holdings Ltd.)

Processing: PIXY - Split: 1 : 40 on 12/16/2019
  ✗ No CIK found for PIXY (Shiftpixy Inc)

Processing: GOVX - Split: 1 : 2,000 on 12/16/2019
  Querying EDGAR (CIK: 0000832489) from 2019-06-19 to 2019-12-31
  Found 15 relevant filings
    ✓ DEF 14A on 2019-12-02 - Score: 7 (Tier A)
    ✓ PRE 14A on 2019-11-21 - Score: 7 (Tier A)
    ✓ 8-K on 2019-11-15 - Score: 8 (Tier A)
    ✓ 10-Q on 2019-11-07 - Score: 3 (Tier B)
    ✓ 8-K on 2019-11-07 - Score: 0 (Tier F)
    ✓ 8-K on 2019-11-01 - Score: 5 (Tier A)
    ✓ 8-K on 2019-10-18 - Score: 0 (Tier F)
    ✓ 8-K on 2019-10-07 - Score: 4 (Tier B)
    ✓ 8-K on 2019-10-01 - Score: 0 (Tier F)
    ✓ 8-K on 2019-08-14 - Score: 0 (Tier F)
  ✓ Saved 10 scored filings to MongoDB

Processing: KEGX - Split: 1 : 200 on 12/16/2016
  ✗ No CIK found for KEGX (Key Energy Services Inc)

Processing: VISL - Split: 1 : 10 on 12/16/2016
  Querying EDGAR (CIK: 0001565228) from 2016-06-19 to 2016-12-31
  Found 38 relevant filings
    ✓ 8-K on 2016-12-27 - Score: 0 (Tier F)
    ✓ 8-K on 2016-12-21 - Score: 4 (Tier B)
    ✓ FWP on 2016-12-19 - Score: 2 (Tier C)
    ✓ 8-K on 2016-12-19 - Score: 0 (Tier F)
    ✓ FWP on 2016-12-16 - Score: 5 (Tier A)
    ✓ 8-K on 2016-12-15 - Score: 8 (Tier A)
    ✓ FWP on 2016-12-12 - Score: 4 (Tier B)
    ✓ 424B3 on 2016-12-09 - Score: 5 (Tier A)
    ✓ 8-K on 2016-12-07 - Score: 0 (Tier F)
    ✓ S-1 on 2016-12-02 - Score: 6 (Tier A)
  ✓ Saved 10 scored filings to MongoDB

Progress: 150/1000 splits processed

Processing: GIGM - Split: 1 : 5 on 12/16/2015
  Querying EDGAR (CIK: 0001105101) from 2015-06-19 to 2015-12-31
  Found 13 relevant filings
    ✓ 6-K on 2015-12-29 - Score: 5 (Tier A)
    ✓ 6-K on 2015-12-16 - Score: 5 (Tier A)
    ✓ 6-K on 2015-11-30 - Score: 5 (Tier A)
    ✓ 6-K on 2015-11-25 - Score: 0 (Tier F)
    ✓ 6-K on 2015-11-18 - Score: 0 (Tier F)
    ✓ 6-K on 2015-11-18 - Score: 0 (Tier F)
    ✓ 6-K on 2015-11-04 - Score: 0 (Tier F)
    ✓ 6-K on 2015-11-04 - Score: 4 (Tier B)
    ✓ 6-K on 2015-10-07 - Score: 0 (Tier F)
    ✓ 6-K on 2015-08-05 - Score: 0 (Tier F)
  ✓ Saved 10 scored filings to MongoDB

Processing: QADB - Split: 1 : 2 on 12/16/2010
  ✗ No CIK found for QADB (Qad Inc)

Processing: LU - Split: 1 : 4 on 12/15/2023
  Querying EDGAR (CIK: 0001816007) from 2023-06-18 to 2023-12-30
  Found 17 relevant filings
    ✓ 6-K on 2023-12-15 - Score: 4 (Tier B)
    ✓ 6-K on 2023-12-05 - Score: 0 (Tier F)
    ✓ 6-K on 2023-11-21 - Score: 0 (Tier F)
    ✓ 6-K on 2023-11-14 - Score: 0 (Tier F)
    ✓ 6-K on 2023-11-14 - Score: 0 (Tier F)
    ✓ 6-K on 2023-11-14 - Score: 5 (Tier A)
    ✓ 6-K on 2023-11-03 - Score: 0 (Tier F)
    ✓ 6-K on 2023-11-01 - Score: 0 (Tier F)
    ✓ 6-K on 2023-10-10 - Score: 0 (Tier F)
    ✓ 6-K on 2023-09-12 - Score: 0 (Tier F)
  ✓ Saved 10 scored filings to MongoDB

Processing: HUBC - Split: 1 : 10 on 12/15/2023
  Querying EDGAR (CIK: 0001905660) from 2023-06-18 to 2023-12-30
  Found 24 relevant filings
    ✓ 6-K on 2023-12-21 - Score: 0 (Tier F)
    ✓ 6-K on 2023-12-18 - Score: 0 (Tier F)
    ✓ 6-K on 2023-12-18 - Score: 0 (Tier F)
    ✓ 6-K on 2023-12-13 - Score: 8 (Tier A)
    ✓ 6-K on 2023-12-11 - Score: 0 (Tier F)
    ✓ 6-K on 2023-12-04 - Score: 0 (Tier F)
    ✓ 6-K on 2023-12-04 - Score: 0 (Tier F)
    ✓ 6-K on 2023-11-29 - Score: 0 (Tier F)
    ✓ 6-K on 2023-11-20 - Score: 0 (Tier F)
    ✓ 6-K on 2023-11-06 - Score: 0 (Tier F)
  ✓ Saved 10 scored filings to MongoDB

Processing: TCBP - Split: 1 : 20 on 12/15/2023
  ✓ Found CIK via company name: 0001872812
  Querying EDGAR (CIK: 0001872812) from 2023-06-18 to 2023-12-30
  Found 13 relevant filings
    ✓ 6-K on 2023-12-21 - Score: 0 (Tier F)
    ✓ 6-K on 2023-12-13 - Score: 0 (Tier F)
    ✓ 424B3 on 2023-11-08 - Score: 4 (Tier B)
    ✓ 6-K on 2023-11-02 - Score: 0 (Tier F)
    ✓ 424B3 on 2023-09-01 - Score: 2 (Tier C)
    ✓ 424B3 on 2023-09-01 - Score: 2 (Tier C)
    ✓ 6-K on 2023-08-31 - Score: 0 (Tier F)
    ✓ 6-K on 2023-08-22 - Score: 0 (Tier F)
    ✓ 6-K on 2023-07-31 - Score: 4 (Tier B)
    ✓ 6-K on 2023-07-24 - Score: 4 (Tier B)
  ✓ Saved 10 scored filings to MongoDB

Processing: SING - Split: 1 : 26 on 12/15/2023
  ✗ No CIK found for SING (Singlepoint Inc)

Processing: COE - Split: 1 : 4 on 12/15/2022
  Querying EDGAR (CIK: 0001659494) from 2022-06-18 to 2022-12-30
  Found 7 relevant filings
    ✓ 6-K on 2022-12-05 - Score: 0 (Tier F)
    ✓ 424B3 on 2022-09-30 - Score: 0 (Tier F)
    ✓ 6-K on 2022-09-30 - Score: 0 (Tier F)
    ✓ 6-K on 2022-08-30 - Score: 0 (Tier F)
    ✓ 6-K on 2022-08-15 - Score: 0 (Tier F)
    ✓ 6-K on 2022-08-08 - Score: 0 (Tier F)
    ✓ 6-K on 2022-06-24 - Score: 0 (Tier F)
  ✓ Saved 7 scored filings to MongoDB

Processing: BETSF - Split: 1 : 15 on 12/15/2022
  ✗ No CIK found for BETSF (Bit Brother Ltd.)

Processing: MGLD - Split: 1 : 10 on 12/15/2015
  Querying EDGAR (CIK: 0001005101) from 2015-06-18 to 2015-12-30
  Found 5 relevant filings
    ✓ 8-K on 2015-12-16 - Score: 7 (Tier A)
    ✓ 10-Q on 2015-11-23 - Score: 0 (Tier F)
    ✓ 10-K on 2015-10-09 - Score: 3 (Tier B)
    ✓ 8-K on 2015-08-14 - Score: 0 (Tier F)
    ✓ 8-K on 2015-08-04 - Score: 0 (Tier F)
  ✓ Saved 5 scored filings to MongoDB

Processing: GENE - Split: 1 : 100 on 12/14/2023
  ✗ No CIK found for GENE (Genetic Technologies Ltd.)

Processing: SRZN - Split: 1 : 15 on 12/14/2023
  Querying EDGAR (CIK: 0001824893) from 2023-06-17 to 2023-12-29
  Found 16 relevant filings
    ✓ 424B3 on 2023-12-13 - Score: 6 (Tier A)
    ✓ 8-K on 2023-12-13 - Score: 7 (Tier A)
    ✓ 424B3 on 2023-12-11 - Score: 6 (Tier A)
    ✓ 8-K on 2023-12-11 - Score: 8 (Tier A)
    ✓ 424B3 on 2023-11-08 - Score: 4 (Tier B)
    ✓ 10-Q on 2023-11-08 - Score: 3 (Tier B)
    ✓ 8-K on 2023-11-08 - Score: 3 (Tier B)
    ✓ DEFA14A on 2023-10-24 - Score: 0 (Tier F)
    ✓ DEF 14A on 2023-10-24 - Score: 6 (Tier A)
    ✓ PRE 14A on 2023-10-13 - Score: 6 (Tier A)
  ✓ Saved 10 scored filings to MongoDB

Processing: AIMD - Split: 1 : 5 on 12/14/2023
  Querying EDGAR (CIK: 0001014763) from 2023-06-17 to 2023-12-29
  Found 18 relevant filings
    ✓ 8-K on 2023-12-22 - Score: 5 (Tier A)
    ✓ 8-K on 2023-12-14 - Score: 9 (Tier A)
    ✓ 8-K on 2023-12-13 - Score: 8 (Tier A)
    ✓ 8-K on 2023-12-11 - Score: 6 (Tier A)
    ✓ S-1 on 2023-12-08 - Score: 6 (Tier A)
    ✓ 8-K on 2023-11-24 - Score: 5 (Tier A)
    ✓ 8-K on 2023-11-13 - Score: 5 (Tier A)
    ✓ 10-Q on 2023-11-09 - Score: 5 (Tier A)
    ✓ DEFA14A on 2023-10-27 - Score: 0 (Tier F)
    ✓ DEF 14A on 2023-10-27 - Score: 6 (Tier A)
  ✓ Saved 10 scored filings to MongoDB

Processing: PHCFF - Split: 1 : 6 on 12/14/2022
  ✗ No CIK found for PHCFF (Puhui Wealth Investment Management Co Ltd.)

Processing: BORR - Split: 1 : 2 on 12/14/2021
  Querying EDGAR (CIK: 0001715497) from 2021-06-17 to 2021-12-29
  Found 18 relevant filings
    ✓ 6-K on 2021-12-28 - Score: 0 (Tier F)
    ✓ 6-K on 2021-12-28 - Score: 0 (Tier F)
    ✓ 6-K on 2021-12-27 - Score: 0 (Tier F)
    ✓ 6-K on 2021-12-07 - Score: 0 (Tier F)
    ✓ 6-K on 2021-11-18 - Score: 5 (Tier A)
    ✓ 6-K on 2021-11-09 - Score: 0 (Tier F)
    ✓ 6-K on 2021-11-09 - Score: 0 (Tier F)
    ✓ 6-K on 2021-09-03 - Score: 0 (Tier F)
    ✓ 6-K on 2021-09-02 - Score: 0 (Tier F)
    ✓ 6-K on 2021-08-31 - Score: 0 (Tier F)
  ✓ Saved 10 scored filings to MongoDB

Processing: SNDA - Split: 1 : 15 on 12/14/2020
  Querying EDGAR (CIK: 0001043000) from 2020-06-17 to 2020-12-29
  Found 12 relevant filings
    ✓ 8-K on 2020-12-14 - Score: 8 (Tier A)
    ✓ 8-K on 2020-11-12 - Score: 0 (Tier F)
    ✓ 10-Q on 2020-11-09 - Score: 3 (Tier B)
    ✓ 8-K on 2020-11-05 - Score: 0 (Tier F)
    ✓ DEF 14A on 2020-11-03 - Score: 7 (Tier A)
    ✓ PRE 14A on 2020-10-09 - Score: 7 (Tier A)
    ✓ 8-K on 2020-09-28 - Score: 0 (Tier F)
    ✓ 8-K on 2020-09-21 - Score: 0 (Tier F)
    ✓ 8-K on 2020-08-18 - Score: 0 (Tier F)
    ✓ 10-Q on 2020-08-07 - Score: 3 (Tier B)
  ✓ Saved 10 scored filings to MongoDB

Processing: CRVO - Split: 1 : 15 on 12/14/2018
  Querying EDGAR (CIK: 0001053691) from 2018-06-17 to 2018-12-29
  Found 7 relevant filings
    ✓ 8-K on 2018-12-14 - Score: 7 (Tier A)
    ✓ 8-K on 2018-11-14 - Score: 0 (Tier F)
    ✓ 10-Q on 2018-11-13 - Score: 3 (Tier B)
    ✓ 8-K on 2018-09-27 - Score: 5 (Tier A)
    ✓ 8-K on 2018-08-31 - Score: 5 (Tier A)
    ✓ 8-K on 2018-08-14 - Score: 0 (Tier F)
    ✓ 10-Q on 2018-08-10 - Score: 3 (Tier B)
  ✓ Saved 7 scored filings to MongoDB

Processing: GBSN - Split: 1 : 59.99 on 12/14/2015
  ✗ No CIK found for GBSN (Great Basin Scientific Inc)

Processing: BOSC - Split: 1 : 4 on 12/14/2012
  Querying EDGAR (CIK: 0001005516) from 2012-06-17 to 2012-12-29
  Found 7 relevant filings
    ✓ 6-K on 2012-12-14 - Score: 6 (Tier A)
    ✓ 6-K on 2012-12-13 - Score: 0 (Tier F)
    ✓ 6-K on 2012-11-29 - Score: 0 (Tier F)
    ✓ 6-K on 2012-10-31 - Score: 0 (Tier F)
    ✓ 6-K on 2012-10-09 - Score: 4 (Tier B)
    ✓ 6-K on 2012-08-09 - Score: 4 (Tier B)
    ✓ 6-K on 2012-07-19 - Score: 4 (Tier B)
  ✓ Saved 7 scored filings to MongoDB

Processing: NYNY - Split: 1 : 3 on 12/14/2011
  ✗ No CIK found for NYNY (Empire Resorts Inc)

Processing: DBGI - Split: 1 : 50 on 12/13/2024
  Querying EDGAR (CIK: 0001668010) from 2024-06-16 to 2024-12-28
  Found 29 relevant filings
    ✓ 8-K on 2024-12-17 - Score: 5 (Tier A)
    ✓ 8-K on 2024-12-16 - Score: 4 (Tier B)
    ✓ 8-K on 2024-12-13 - Score: 7 (Tier A)
    ✓ 8-K on 2024-12-12 - Score: 4 (Tier B)
    ✓ 8-K on 2024-12-11 - Score: 7 (Tier A)
    ✓ 8-K on 2024-12-05 - Score: 4 (Tier B)
    ✓ 8-K on 2024-12-03 - Score: 7 (Tier A)
    ✓ 424B5 on 2024-12-02 - Score: 1 (Tier C)
    ✓ 8-K on 2024-11-22 - Score: 4 (Tier B)
    ✓ 8-K on 2024-11-20 - Score: 4 (Tier B)
  ✓ Saved 10 scored filings to MongoDB

Processing: MNTS - Split: 1 : 14 on 12/13/2024
  Querying EDGAR (CIK: 0001781162) from 2024-06-16 to 2024-12-28
  Found 25 relevant filings
    ✓ 8-K on 2024-12-18 - Score: 6 (Tier A)
    ✓ 8-K on 2024-12-17 - Score: 4 (Tier B)
    ✓ 8-K on 2024-12-16 - Score: 5 (Tier A)
    ✓ S-1 on 2024-12-11 - Score: 6 (Tier A)
    ✓ 8-K on 2024-12-10 - Score: 8 (Tier A)
    ✓ 8-K on 2024-12-05 - Score: 9 (Tier A)
    ✓ S-1 on 2024-12-02 - Score: 6 (Tier A)
    ✓ DEFA14A on 2024-11-22 - Score: 0 (Tier F)
    ✓ DEFA14A on 2024-11-22 - Score: 0 (Tier F)
    ✓ 10-Q on 2024-11-14 - Score: 5 (Tier A)
  ✓ Saved 10 scored filings to MongoDB

Processing: MLGO - Split: 1 : 20 on 12/13/2024
  Querying EDGAR (CIK: 0001800392) from 2024-06-16 to 2024-12-28
  Found 10 relevant filings
    ✓ 6-K on 2024-12-06 - Score: 0 (Tier F)
    ✓ 6-K on 2024-12-05 - Score: 5 (Tier A)
    ✓ 6-K on 2024-10-23 - Score: 0 (Tier F)
    ✓ 6-K on 2024-10-15 - Score: 0 (Tier F)
    ✓ 6-K on 2024-10-09 - Score: 0 (Tier F)
    ✓ 424B5 on 2024-10-09 - Score: 6 (Tier A)
    ✓ 6-K on 2024-09-25 - Score: 0 (Tier F)
    ✓ 6-K on 2024-09-23 - Score: 4 (Tier B)
    ✓ 424B5 on 2024-08-02 - Score: 6 (Tier A)
    ✓ 6-K on 2024-08-02 - Score: 0 (Tier F)
  ✓ Saved 10 scored filings to MongoDB

Processing: BLUE - Split: 1 : 20 on 12/13/2024
  ✗ No CIK found for BLUE (Bluebird Bio Inc)

Processing: CYTOF - Split: 1 : 20 on 12/13/2023
  Querying EDGAR (CIK: 0001601936) from 2023-06-16 to 2023-12-28
  Found 14 relevant filings
    ✓ 6-K on 2023-12-11 - Score: 0 (Tier F)
    ✓ 6-K on 2023-12-11 - Score: 7 (Tier A)
    ✓ 6-K on 2023-12-08 - Score: 8 (Tier A)
    ✓ 6-K on 2023-11-22 - Score: 5 (Tier A)
    ✓ 6-K on 2023-11-21 - Score: 7 (Tier A)
    ✓ 6-K on 2023-10-31 - Score: 0 (Tier F)
    ✓ 6-K on 2023-10-04 - Score: 5 (Tier A)
    ✓ 6-K on 2023-09-12 - Score: 0 (Tier F)
    ✓ 6-K on 2023-07-28 - Score: 5 (Tier A)
    ✓ 6-K on 2023-07-26 - Score: 5 (Tier A)
  ✓ Saved 10 scored filings to MongoDB

Processing: IMVIQ - Split: 1 : 10 on 12/13/2022
  ✓ Found CIK via company name: 0001876588
  Querying EDGAR (CIK: 0001876588) from 2022-06-16 to 2022-12-28
  Found 5 relevant filings
    ✓ 10-Q on 2022-11-09 - Score: 3 (Tier B)
    ✓ 8-K on 2022-11-09 - Score: 4 (Tier B)
    ✓ 8-K on 2022-08-12 - Score: 4 (Tier B)
    ✓ 10-Q on 2022-08-10 - Score: 3 (Tier B)
    ✓ 8-K on 2022-08-10 - Score: 4 (Tier B)
  ✓ Saved 5 scored filings to MongoDB

Processing: PSFE - Split: 1 : 12 on 12/13/2022
  Querying EDGAR (CIK: 0001833835) from 2022-06-16 to 2022-12-28
  Found 7 relevant filings
    ✓ 6-K on 2022-12-12 - Score: 8 (Tier A)
    ✓ 6-K on 2022-11-21 - Score: 6 (Tier A)
    ✓ 6-K on 2022-11-17 - Score: 9 (Tier A)
    ✓ 6-K on 2022-11-10 - Score: 0 (Tier F)
    ✓ 6-K on 2022-10-19 - Score: 6 (Tier A)
    ✓ 6-K on 2022-08-30 - Score: 0 (Tier F)
    ✓ 6-K on 2022-08-10 - Score: 0 (Tier F)
  ✓ Saved 7 scored filings to MongoDB

Processing: DPSI - Split: 1 : 2 on 12/13/2021
  ✗ No CIK found for DPSI (Decisionpoint Systems Inc)

Processing: MCLDF - Split: 1 : 10 on 12/13/2019
  ✗ No CIK found for MCLDF (Mcloud Technologies Corp)

Processing: SRC - Split: 1 : 5 on 12/13/2018
  ✗ No CIK found for SRC (Spirit Realty Capital Inc)

Processing: MGLD - Split: 1 : 30 on 12/13/2017
  Querying EDGAR (CIK: 0001005101) from 2017-06-16 to 2017-12-28
  Found 6 relevant filings
    ✓ 8-K on 2017-12-19 - Score: 0 (Tier F)
    ✓ 8-K on 2017-12-14 - Score: 7 (Tier A)
    ✓ 8-K on 2017-11-21 - Score: 0 (Tier F)
    ✓ 10-Q on 2017-11-14 - Score: 4 (Tier B)
    ✓ 8-K on 2017-10-20 - Score: 0 (Tier F)
    ✓ 10-K on 2017-10-13 - Score: 4 (Tier B)
  ✓ Saved 6 scored filings to MongoDB

Processing: XBKS - Split: 1 : 10 on 12/13/2016
  ✗ No CIK found for XBKS (Xenith Bankshares Inc)

Processing: SBCF - Split: 1 : 5 on 12/13/2013
  Querying EDGAR (CIK: 0000730708) from 2013-06-16 to 2013-12-28
  Found 0 relevant filings
  ⚠ Historical split: SEC API only returns filings from 2016-07-14 onwards (split date: 12/13/2013)
     Date window: [2013-06-16 to 2013-12-28]
     Total filings available for CIK: 1005
     Filing date range available: 2016-07-14 to 2025-11-12

Processing: DMKPQ - Split: 1 : 17 on 12/13/2013
  ✗ No CIK found for DMKPQ (Dmk Pharmaceuticals Corp)

Processing: AUVIQ - Split: 1 : 25 on 12/12/2023
  ✓ Found CIK via company name: 0000922224
  Querying EDGAR (CIK: 0000922224) from 2023-06-15 to 2023-12-27
  Found 8 relevant filings
    ✓ 8-K on 2023-12-22 - Score: 0 (Tier F)
    ✓ 8-K on 2023-12-08 - Score: 0 (Tier F)
    ✓ 8-K on 2023-12-06 - Score: 0 (Tier F)
    ✓ 8-K on 2023-11-07 - Score: 0 (Tier F)
    ✓ 10-Q on 2023-11-02 - Score: 2 (Tier C)
    ✓ 8-K on 2023-11-02 - Score: 0 (Tier F)
    ✓ 10-Q on 2023-08-04 - Score: 2 (Tier C)
    ✓ 8-K on 2023-08-04 - Score: 0 (Tier F)
  ✓ Saved 8 scored filings to MongoDB

Processing: BIMI - Split: 1 : 10 on 12/12/2022
  ✗ No CIK found for BIMI (Bimi Holdings Inc)

Processing: NUWE - Split: 1 : 100 on 12/12/2022
  Querying EDGAR (CIK: 0001506492) from 2022-06-15 to 2022-12-27
  Found 23 relevant filings
    ✓ 8-K on 2022-12-27 - Score: 4 (Tier B)
    ✓ 8-K on 2022-12-09 - Score: 5 (Tier A)
    ✓ 8-K on 2022-12-09 - Score: 5 (Tier A)
    ✓ DEFA14A on 2022-12-08 - Score: 4 (Tier B)
    ✓ 8-K on 2022-12-08 - Score: 5 (Tier A)
    ✓ 8-K on 2022-12-06 - Score: 7 (Tier A)
    ✓ 8-K on 2022-11-30 - Score: 5 (Tier A)
    ✓ 10-Q on 2022-11-08 - Score: 5 (Tier A)
    ✓ 8-K on 2022-11-08 - Score: 4 (Tier B)
    ✓ DEF 14A on 2022-11-07 - Score: 4 (Tier B)
  ✓ Saved 10 scored filings to MongoDB

Processing: OCFT - Split: 1 : 10 on 12/12/2022
  Querying EDGAR (CIK: 0001780531) from 2022-06-15 to 2022-12-27
  Found 17 relevant filings
    ✓ 6-K on 2022-12-15 - Score: 0 (Tier F)
    ✓ 6-K on 2022-11-30 - Score: 0 (Tier F)
    ✓ 6-K on 2022-11-25 - Score: 0 (Tier F)
    ✓ 6-K on 2022-11-10 - Score: 0 (Tier F)
    ✓ 6-K on 2022-11-03 - Score: 4 (Tier B)
    ✓ 6-K on 2022-10-31 - Score: 0 (Tier F)
    ✓ 6-K on 2022-10-17 - Score: 4 (Tier B)
    ✓ 6-K on 2022-10-03 - Score: 0 (Tier F)
    ✓ 6-K on 2022-08-22 - Score: 0 (Tier F)
    ✓ 6-K on 2022-08-17 - Score: 0 (Tier F)
  ✓ Saved 10 scored filings to MongoDB

Processing: YDKG - Split: 1 : 4 on 12/12/2022
  Querying EDGAR (CIK: 0001413745) from 2022-06-15 to 2022-12-27
  Found 5 relevant filings
    ✓ 6-K on 2022-11-30 - Score: 0 (Tier F)
    ✓ 6-K on 2022-11-04 - Score: 0 (Tier F)
    ✓ 6-K on 2022-10-24 - Score: 0 (Tier F)
    ✓ 6-K on 2022-09-29 - Score: 0 (Tier F)
    ✓ 6-K on 2022-09-09 - Score: 0 (Tier F)
  ✓ Saved 5 scored filings to MongoDB

Processing: IMBIQ - Split: 1 : 10 on 12/12/2019
  ✗ No CIK found for IMBIQ (Imedia Brands Inc)

Processing: ASXC - Split: 1 : 13 on 12/12/2019
  ✗ No CIK found for ASXC (Asensus Surgical Inc)

Processing: VISN - Split: 1 : 20 on 12/12/2012
  ✗ No CIK found for VISN (Visionchina Media Inc)

Processing: SNCR - Split: 1 : 9 on 12/11/2023
  Querying EDGAR (CIK: 0001131554) from 2023-06-14 to 2023-12-26
  Found 13 relevant filings
    ✓ 8-K on 2023-12-22 - Score: 4 (Tier B)
    ✓ 8-K on 2023-12-07 - Score: 9 (Tier A)
    ✓ 8-K on 2023-12-04 - Score: 8 (Tier A)
    ✓ DEF 14A on 2023-11-13 - Score: 6 (Tier A)
    ✓ 10-Q on 2023-11-08 - Score: 3 (Tier B)
    ✓ 8-K on 2023-11-07 - Score: 4 (Tier B)
    ✓ 8-K on 2023-11-03 - Score: 5 (Tier A)
    ✓ PRE 14A on 2023-11-02 - Score: 6 (Tier A)
    ✓ 10-Q on 2023-08-09 - Score: 3 (Tier B)
    ✓ 8-K on 2023-08-08 - Score: 4 (Tier B)
  ✓ Saved 10 scored filings to MongoDB

Processing: JG - Split: 1 : 20 on 12/11/2023
  Querying EDGAR (CIK: 0001737339) from 2023-06-14 to 2023-12-26
  Found 7 relevant filings
    ✓ 6-K on 2023-12-06 - Score: 0 (Tier F)
    ✓ 6-K on 2023-11-30 - Score: 0 (Tier F)
    ✓ 6-K on 2023-11-16 - Score: 0 (Tier F)
    ✓ 6-K on 2023-09-07 - Score: 0 (Tier F)
    ✓ 6-K on 2023-09-05 - Score: 0 (Tier F)
    ✓ 6-K on 2023-06-28 - Score: 4 (Tier B)
    ✓ 6-K on 2023-06-16 - Score: 0 (Tier F)
  ✓ Saved 7 scored filings to MongoDB

Processing: SCPX - Split: 1 : 7 on 12/11/2020
  ✗ No CIK found for SCPX (Scorpius Holdings Inc)

Processing: ELYS - Split: 1 : 8 on 12/11/2019
  ✗ No CIK found for ELYS (Elys Game Technology Corp)

Processing: CLSK - Split: 1 : 10 on 12/11/2019
  Querying EDGAR (CIK: 0000827876) from 2019-06-14 to 2019-12-26
  Found 10 relevant filings
    ✓ 8-K on 2019-12-18 - Score: 0 (Tier F)
    ✓ 10-K on 2019-12-16 - Score: 6 (Tier A)
    ✓ 8-K on 2019-12-10 - Score: 10 (Tier A)
    ✓ 8-K on 2019-11-12 - Score: 0 (Tier F)
    ✓ 8-K on 2019-10-09 - Score: 0 (Tier F)
    ✓ 10-Q on 2019-08-14 - Score: 2 (Tier C)
    ✓ 8-K on 2019-08-14 - Score: 0 (Tier F)
    ✓ 8-K on 2019-08-08 - Score: 4 (Tier B)
    ✓ PRE 14C on 2019-06-26 - Score: 3 (Tier B)
    ✓ 8-K on 2019-06-26 - Score: 0 (Tier F)
  ✓ Saved 10 scored filings to MongoDB

Processing: WKHS - Split: 1 : 10 on 12/11/2015
  Querying EDGAR (CIK: 0001425287) from 2015-06-14 to 2015-12-26
  Found 12 relevant filings
    ✓ 8-K on 2015-12-21 - Score: 0 (Tier F)
    ✓ 8-K on 2015-12-10 - Score: 7 (Tier A)
    ✓ 10-Q on 2015-11-16 - Score: 4 (Tier B)
    ✓ 8-K on 2015-11-12 - Score: 5 (Tier A)
    ✓ 8-K on 2015-09-15 - Score: 0 (Tier F)
    ✓ 8-K on 2015-09-10 - Score: 0 (Tier F)
    ✓ 10-Q on 2015-08-14 - Score: 1 (Tier C)
    ✓ 8-K on 2015-08-11 - Score: 0 (Tier F)
    ✓ 8-K on 2015-07-17 - Score: 0 (Tier F)
    ✓ 8-K on 2015-07-14 - Score: 0 (Tier F)
  ✓ Saved 10 scored filings to MongoDB

Processing: HELIQ - Split: 1 : 30 on 12/11/2015
  ✗ No CIK found for HELIQ (Chc Group Ltd.)

Processing: JL - Split: 1 : 10 on 12/10/2024
  Querying EDGAR (CIK: 0001948436) from 2024-06-13 to 2024-12-25
  Found 3 relevant filings
    ✓ 6-K on 2024-12-09 - Score: 7 (Tier A)
    ✓ 6-K on 2024-11-22 - Score: 5 (Tier A)
    ✓ 20-F on 2024-07-31 - Score: 5 (Tier A)
  ✓ Saved 3 scored filings to MongoDB

Progress: 200/1000 splits processed

Processing: QTT - Split: 1 : 10 on 12/10/2021
  ✓ Found CIK via company name: 0001733298
  Querying EDGAR (CIK: 0001733298) from 2021-06-13 to 2021-12-25
  Found 3 relevant filings
    ✓ 6-K on 2021-12-21 - Score: 0 (Tier F)
    ✓ 6-K on 2021-12-02 - Score: 0 (Tier F)
    ✓ 6-K on 2021-09-07 - Score: 0 (Tier F)
  ✓ Saved 3 scored filings to MongoDB

Processing: TPST - Split: 1 : 15 on 12/10/2018
  Querying EDGAR (CIK: 0001544227) from 2018-06-13 to 2018-12-25
  Found 15 relevant filings
    ✓ 424B3 on 2018-12-20 - Score: 7 (Tier A)
    ✓ 8-K on 2018-12-13 - Score: 9 (Tier A)
    ✓ 8-K on 2018-12-06 - Score: 8 (Tier A)
    ✓ DEFA14A on 2018-11-30 - Score: 6 (Tier A)
    ✓ 8-K on 2018-11-30 - Score: 7 (Tier A)
    ✓ 8-K on 2018-11-26 - Score: 6 (Tier A)
    ✓ DEFA14A on 2018-11-19 - Score: 6 (Tier A)
    ✓ 8-K on 2018-11-19 - Score: 7 (Tier A)
    ✓ 10-Q on 2018-11-09 - Score: 5 (Tier A)
    ✓ S-3 on 2018-11-06 - Score: 6 (Tier A)
  ✓ Saved 10 scored filings to MongoDB

Processing: JASO - Split: 1 : 5 on 12/10/2012
  ✗ No CIK found for JASO (Ja Solar Holdings Co Ltd.)

Processing: UNXLQ - Split: 1 : 15 on 12/10/2010
  ✗ No CIK found for UNXLQ (Uni-pixel)

Processing: HUIZ - Split: 1 : 5 on 12/09/2024
  Querying EDGAR (CIK: 0001778982) from 2024-06-12 to 2024-12-24
  Found 8 relevant filings
    ✓ 6-K on 2024-12-13 - Score: 0 (Tier F)
    ✓ 6-K on 2024-11-19 - Score: 0 (Tier F)
    ✓ 6-K on 2024-10-31 - Score: 0 (Tier F)
    ✓ 6-K on 2024-09-26 - Score: 0 (Tier F)
    ✓ 6-K on 2024-09-16 - Score: 4 (Tier B)
    ✓ 6-K on 2024-09-06 - Score: 0 (Tier F)
    ✓ 6-K on 2024-07-17 - Score: 4 (Tier B)
    ✓ 6-K on 2024-07-17 - Score: 0 (Tier F)
  ✓ Saved 8 scored filings to MongoDB

Processing: UPHL - Split: 1 : 10 on 12/09/2022
  ✗ No CIK found for UPHL (Uphealth Inc)

Processing: MYSZ - Split: 1 : 25 on 12/09/2022
  Querying EDGAR (CIK: 0001211805) from 2022-06-12 to 2022-12-24
  Found 10 relevant filings
    ✓ 8-K on 2022-12-07 - Score: 6 (Tier A)
    ✓ 8-K on 2022-11-15 - Score: 4 (Tier B)
    ✓ 10-Q on 2022-11-14 - Score: 1 (Tier C)
    ✓ DEF 14A on 2022-11-04 - Score: 6 (Tier A)
    ✓ PRE 14A on 2022-10-24 - Score: 6 (Tier A)
    ✓ 8-K on 2022-10-12 - Score: 5 (Tier A)
    ✓ 8-K on 2022-10-04 - Score: 5 (Tier A)
    ✓ 8-K on 2022-08-16 - Score: 4 (Tier B)
    ✓ 10-Q on 2022-08-15 - Score: 1 (Tier C)
    ✓ 8-K on 2022-07-07 - Score: 4 (Tier B)
  ✓ Saved 10 scored filings to MongoDB

Processing: NDRA - Split: 1 : 20 on 12/09/2022
  Querying EDGAR (CIK: 0001681682) from 2022-06-12 to 2022-12-24
  Found 14 relevant filings
    ✓ 8-K on 2022-12-23 - Score: 6 (Tier A)
    ✓ 8-K on 2022-12-19 - Score: 5 (Tier A)
    ✓ 8-K on 2022-12-08 - Score: 7 (Tier A)
    ✓ 8-K on 2022-12-02 - Score: 6 (Tier A)
    ✓ 10-Q on 2022-11-14 - Score: 5 (Tier A)
    ✓ 8-K on 2022-11-14 - Score: 4 (Tier B)
    ✓ DEFA14A on 2022-10-17 - Score: 0 (Tier F)
    ✓ DEF 14A on 2022-10-17 - Score: 6 (Tier A)
    ✓ PRE 14A on 2022-09-27 - Score: 6 (Tier A)
    ✓ 8-K on 2022-09-27 - Score: 6 (Tier A)
  ✓ Saved 10 scored filings to MongoDB

Processing: GROM - Split: 1 : 30 on 12/09/2022
  ✗ No CIK found for GROM (Grom Social Enterprises Inc)

Processing: CYTH - Split: 1 : 100 on 12/09/2020
  ✗ No CIK found for CYTH (Cyclo Therapeutics Inc)

Processing: EYPT - Split: 1 : 10 on 12/09/2020
  Querying EDGAR (CIK: 0001314102) from 2020-06-12 to 2020-12-24
  Found 22 relevant filings
    ✓ 8-K on 2020-12-18 - Score: 5 (Tier A)
    ✓ 8-K on 2020-12-08 - Score: 6 (Tier A)
    ✓ 8-K on 2020-12-03 - Score: 8 (Tier A)
    ✓ 10-Q on 2020-11-06 - Score: 1 (Tier C)
    ✓ 8-K on 2020-11-05 - Score: 4 (Tier B)
    ✓ DEFA14A on 2020-10-16 - Score: 5 (Tier A)
    ✓ DEFA14A on 2020-10-16 - Score: 0 (Tier F)
    ✓ DEF 14A on 2020-10-16 - Score: 7 (Tier A)
    ✓ 8-K on 2020-10-08 - Score: 4 (Tier B)
    ✓ 8-K on 2020-10-07 - Score: 4 (Tier B)
  ✓ Saved 10 scored filings to MongoDB

Processing: AYTU - Split: 1 : 10 on 12/09/2020
  Querying EDGAR (CIK: 0001385818) from 2020-06-12 to 2020-12-24
  Found 20 relevant filings
    ✓ 8-K on 2020-12-16 - Score: 4 (Tier B)
    ✓ 8-K on 2020-12-15 - Score: 5 (Tier A)
    ✓ 424B5 on 2020-12-14 - Score: 6 (Tier A)
    ✓ 8-K on 2020-12-14 - Score: 4 (Tier B)
    ✓ FWP on 2020-12-11 - Score: 1 (Tier C)
    ✓ FWP on 2020-12-10 - Score: 1 (Tier C)
    ✓ 424B5 on 2020-12-10 - Score: 5 (Tier A)
    ✓ 8-K on 2020-12-10 - Score: 4 (Tier B)
    ✓ 8-K on 2020-12-10 - Score: 4 (Tier B)
    ✓ 8-K on 2020-12-10 - Score: 4 (Tier B)
  ✓ Saved 10 scored filings to MongoDB

Processing: BEBE - Split: 1 : 10 on 12/09/2016
  Querying EDGAR (CIK: 0002079933) from 2016-06-12 to 2016-12-24
  Found 0 relevant filings
  ⚠ Historical split: SEC API only returns filings from 2025-08-18 onwards (split date: 12/09/2016)
     Date window: [2016-06-12 to 2016-12-24]
     Total filings available for CIK: 2
     Filing date range available: 2025-08-18 to 2025-09-17

Processing: TIL - Split: 1 : 20 on 12/08/2023
  Querying EDGAR (CIK: 0001789769) from 2023-06-11 to 2023-12-23
  Found 8 relevant filings
    ✓ 8-K on 2023-12-08 - Score: 8 (Tier A)
    ✓ 8-K on 2023-11-27 - Score: 7 (Tier A)
    ✓ 10-Q on 2023-11-13 - Score: 3 (Tier B)
    ✓ 8-K on 2023-11-13 - Score: 4 (Tier B)
    ✓ 10-Q on 2023-08-14 - Score: 3 (Tier B)
    ✓ 8-K on 2023-08-14 - Score: 4 (Tier B)
    ✓ 8-K on 2023-06-26 - Score: 4 (Tier B)
    ✓ 8-K on 2023-06-14 - Score: 6 (Tier A)
  ✓ Saved 8 scored filings to MongoDB

Processing: SNCE - Split: 1 : 20 on 12/08/2023
  ✗ No CIK found for SNCE (Science 37 Holdings Inc)

Processing: CENN - Split: 1 : 10 on 12/08/2023
  Querying EDGAR (CIK: 0001707919) from 2023-06-11 to 2023-12-23
  Found 20 relevant filings
    ✓ 8-K on 2023-12-19 - Score: 5 (Tier A)
    ✓ DEFA14A on 2023-12-15 - Score: 0 (Tier F)
    ✓ DEF 14A on 2023-12-15 - Score: 6 (Tier A)
    ✓ 8-K on 2023-11-30 - Score: 7 (Tier A)
    ✓ PRE 14A on 2023-11-27 - Score: 2 (Tier C)
    ✓ 10-Q on 2023-11-14 - Score: 1 (Tier C)
    ✓ 8-K on 2023-11-01 - Score: 6 (Tier A)
    ✓ 8-K on 2023-10-27 - Score: 6 (Tier A)
    ✓ 8-K on 2023-09-11 - Score: 5 (Tier A)
    ✓ 8-K on 2023-09-01 - Score: 7 (Tier A)
  ✓ Saved 10 scored filings to MongoDB

Processing: LCFY - Split: 1 : 20 on 12/08/2022
  Querying EDGAR (CIK: 0001875547) from 2022-06-11 to 2022-12-23
  Found 10 relevant filings
    ✓ 6-K on 2022-12-23 - Score: 0 (Tier F)
    ✓ 6-K on 2022-12-07 - Score: 7 (Tier A)
    ✓ 6-K on 2022-11-25 - Score: 0 (Tier F)
    ✓ 20-F on 2022-11-15 - Score: 3 (Tier B)
    ✓ 6-K on 2022-11-09 - Score: 0 (Tier F)
    ✓ 6-K on 2022-10-04 - Score: 0 (Tier F)
    ✓ 6-K on 2022-09-06 - Score: 0 (Tier F)
    ✓ 6-K on 2022-07-27 - Score: 0 (Tier F)
    ✓ 6-K on 2022-07-15 - Score: 0 (Tier F)
    ✓ 6-K on 2022-07-05 - Score: 5 (Tier A)
  ✓ Saved 10 scored filings to MongoDB

Processing: PCSA - Split: 1 : 7 on 12/08/2017
  Querying EDGAR (CIK: 0001533743) from 2017-06-11 to 2017-12-23
  Found 17 relevant filings
    ✓ 8-K on 2017-12-15 - Score: 0 (Tier F)
    ✓ 8-K on 2017-12-06 - Score: 0 (Tier F)
    ✓ 10-Q on 2017-11-20 - Score: 2 (Tier C)
    ✓ 8-K on 2017-11-02 - Score: 0 (Tier F)
    ✓ 8-K on 2017-10-30 - Score: 5 (Tier A)
    ✓ 8-K on 2017-10-20 - Score: 0 (Tier F)
    ✓ 8-K on 2017-10-12 - Score: 7 (Tier A)
    ✓ 8-K on 2017-10-05 - Score: 0 (Tier F)
    ✓ 10-Q on 2017-10-04 - Score: 0 (Tier F)
    ✓ 10-Q on 2017-10-04 - Score: 0 (Tier F)
  ✓ Saved 10 scored filings to MongoDB

Processing: HQI - Split: 1 : 12 on 12/08/2017
  Querying EDGAR (CIK: 0001140102) from 2017-06-11 to 2017-12-23
  Found 8 relevant filings
    ✓ 8-K on 2017-12-07 - Score: 9 (Tier A)
    ✓ PRE 14A on 2017-11-24 - Score: 7 (Tier A)
    ✓ DEFA14A on 2017-11-14 - Score: 0 (Tier F)
    ✓ 10-Q on 2017-11-13 - Score: 5 (Tier A)
    ✓ 8-K on 2017-09-08 - Score: 0 (Tier F)
    ✓ 10-Q on 2017-08-14 - Score: 2 (Tier C)
    ✓ 8-K on 2017-08-04 - Score: 4 (Tier B)
    ✓ 8-K on 2017-07-24 - Score: 0 (Tier F)
  ✓ Saved 8 scored filings to MongoDB

Processing: LIVE - Split: 1 : 6 on 12/08/2016
  Querying EDGAR (CIK: 0001045742) from 2016-06-11 to 2016-12-23
  Found 6 relevant filings
    ✓ 8-K on 2016-11-25 - Score: 10 (Tier A)
    ✓ 8-K on 2016-11-09 - Score: 0 (Tier F)
    ✓ 10-Q on 2016-08-15 - Score: 5 (Tier A)
    ✓ 8-K on 2016-07-25 - Score: 0 (Tier F)
    ✓ 8-K on 2016-06-21 - Score: 0 (Tier F)
    ✓ DEF 14A on 2016-06-13 - Score: 3 (Tier B)
  ✓ Saved 6 scored filings to MongoDB

Processing: INVT - Split: 1 : 10 on 12/08/2015
  ✗ No CIK found for INVT (Inventergy Global Inc)

Processing: VRTA - Split: 1 : 4 on 12/08/2014
  ✗ No CIK found for VRTA (Vestin Realty Mortgage I Inc)

Processing: XOS - Split: 1 : 30 on 12/07/2023
  Querying EDGAR (CIK: 0001819493) from 2023-06-10 to 2023-12-22
  Found 19 relevant filings
    ✓ 8-K on 2023-12-21 - Score: 0 (Tier F)
    ✓ 424B3 on 2023-12-06 - Score: 5 (Tier A)
    ✓ 8-K on 2023-12-06 - Score: 8 (Tier A)
    ✓ 424B3 on 2023-12-01 - Score: 2 (Tier C)
    ✓ 8-K on 2023-12-01 - Score: 0 (Tier F)
    ✓ 424B3 on 2023-11-22 - Score: 2 (Tier C)
    ✓ 8-K on 2023-11-22 - Score: 0 (Tier F)
    ✓ 424B3 on 2023-11-09 - Score: 2 (Tier C)
    ✓ 10-Q on 2023-11-09 - Score: 1 (Tier C)
    ✓ 8-K on 2023-11-09 - Score: 0 (Tier F)
  ✓ Saved 10 scored filings to MongoDB

Processing: PAVM - Split: 1 : 15 on 12/07/2023
  Querying EDGAR (CIK: 0001624326) from 2023-06-10 to 2023-12-22
  Found 7 relevant filings
    ✓ 8-K on 2023-12-05 - Score: 7 (Tier A)
    ✓ 8-K on 2023-11-15 - Score: 5 (Tier A)
    ✓ 10-Q on 2023-11-13 - Score: 5 (Tier A)
    ✓ 8-K on 2023-10-18 - Score: 5 (Tier A)
    ✓ 10-Q on 2023-08-14 - Score: 5 (Tier A)
    ✓ 8-K on 2023-06-28 - Score: 4 (Tier B)
    ✓ 8-K on 2023-06-21 - Score: 4 (Tier B)
  ✓ Saved 7 scored filings to MongoDB

Processing: XHG - Split: 1 : 40 on 12/07/2023
  Querying EDGAR (CIK: 0001769256) from 2023-06-10 to 2023-12-22
  Found 10 relevant filings
    ✓ 6-K on 2023-12-22 - Score: 0 (Tier F)
    ✓ 6-K on 2023-12-01 - Score: 0 (Tier F)
    ✓ 6-K on 2023-11-22 - Score: 0 (Tier F)
    ✓ 6-K on 2023-11-01 - Score: 0 (Tier F)
    ✓ 6-K on 2023-10-27 - Score: 0 (Tier F)
    ✓ 6-K on 2023-10-02 - Score: 0 (Tier F)
    ✓ 6-K on 2023-09-18 - Score: 0 (Tier F)
    ✓ 6-K on 2023-08-10 - Score: 0 (Tier F)
    ✓ 6-K on 2023-08-02 - Score: 6 (Tier A)
    ✓ 6-K on 2023-06-30 - Score: 0 (Tier F)
  ✓ Saved 10 scored filings to MongoDB

Processing: WFCF - Split: 1 : 4 on 12/07/2020
  Querying EDGAR (CIK: 0001360565) from 2020-06-10 to 2020-12-22
  Found 8 relevant filings
    ✓ 8-K on 2020-12-07 - Score: 6 (Tier A)
    ✓ 8-K on 2020-12-01 - Score: 9 (Tier A)
    ✓ 8-K on 2020-11-25 - Score: 7 (Tier A)
    ✓ 8-K on 2020-11-10 - Score: 0 (Tier F)
    ✓ 10-Q on 2020-11-05 - Score: 2 (Tier C)
    ✓ 8-K on 2020-09-14 - Score: 5 (Tier A)
    ✓ 8-K on 2020-08-17 - Score: 0 (Tier F)
    ✓ 10-Q on 2020-08-13 - Score: 0 (Tier F)
  ✓ Saved 8 scored filings to MongoDB

Processing: ICLD - Split: 1 : 4 on 12/07/2017
  ✗ No CIK found for ICLD (Intercloud Systems Inc)

Processing: AHPIQ - Split: 1 : 2 on 12/07/2016
  ✓ Found CIK via company name: 0000026058
  Querying EDGAR (CIK: 0000026058) from 2016-06-10 to 2016-12-22
  Found 8 relevant filings
    ✓ 8-K on 2016-11-02 - Score: 0 (Tier F)
    ✓ 10-Q on 2016-10-28 - Score: 0 (Tier F)
    ✓ 8-K on 2016-10-28 - Score: 0 (Tier F)
    ✓ 8-K on 2016-09-09 - Score: 0 (Tier F)
    ✓ 8-K on 2016-08-08 - Score: 0 (Tier F)
    ✓ 8-K on 2016-08-02 - Score: 0 (Tier F)
    ✓ 10-Q on 2016-07-29 - Score: 0 (Tier F)
    ✓ 8-K on 2016-07-29 - Score: 0 (Tier F)
  ✓ Saved 8 scored filings to MongoDB

Processing: ENSC - Split: 1 : 15 on 12/06/2024
  Querying EDGAR (CIK: 0001716947) from 2024-06-09 to 2024-12-21
  Found 16 relevant filings
    ✓ 8-K on 2024-12-03 - Score: 8 (Tier A)
    ✓ 8-K on 2024-11-21 - Score: 4 (Tier B)
    ✓ DEFA14A on 2024-11-19 - Score: 3 (Tier B)
    ✓ 10-Q on 2024-11-12 - Score: 3 (Tier B)
    ✓ 8-K on 2024-11-12 - Score: 4 (Tier B)
    ✓ 8-K on 2024-10-18 - Score: 8 (Tier A)
    ✓ DEFA14A on 2024-10-18 - Score: 0 (Tier F)
    ✓ DEF 14A on 2024-10-18 - Score: 6 (Tier A)
    ✓ S-3 on 2024-10-09 - Score: 6 (Tier A)
    ✓ PRE 14A on 2024-10-07 - Score: 6 (Tier A)
  ✓ Saved 10 scored filings to MongoDB

Processing: CZOOF - Split: 1 : 100 on 12/06/2023
  ✗ No CIK found for CZOOF (Cazoo Group Ltd.)

Processing: DRRX - Split: 1 : 10 on 12/06/2022
  ✗ No CIK found for DRRX (Durect Corp)

Processing: CKPT - Split: 1 : 10 on 12/06/2022
  ✗ No CIK found for CKPT (Checkpoint Therapeutics Inc)

Processing: IDR - Split: 1 : 14 on 12/06/2021
  Querying EDGAR (CIK: 0001030192) from 2021-06-09 to 2021-12-21
  Found 13 relevant filings
    ✓ 8-K on 2021-12-08 - Score: 7 (Tier A)
    ✓ 8-K on 2021-11-17 - Score: 0 (Tier F)
    ✓ 10-Q on 2021-11-15 - Score: 3 (Tier B)
    ✓ 8-K on 2021-10-28 - Score: 0 (Tier F)
    ✓ 8-K on 2021-10-27 - Score: 0 (Tier F)
    ✓ 8-K on 2021-10-22 - Score: 0 (Tier F)
    ✓ 8-K on 2021-10-18 - Score: 0 (Tier F)
    ✓ 8-K on 2021-10-07 - Score: 5 (Tier A)
    ✓ DEF 14A on 2021-09-16 - Score: 6 (Tier A)
    ✓ 8-K on 2021-09-02 - Score: 4 (Tier B)
  ✓ Saved 10 scored filings to MongoDB

Processing: FWPAY - Split: 1 : 7 on 12/06/2019
  ✗ No CIK found for FWPAY (Forward Pharma A)

Processing: RTCJF - Split: 1 : 4 on 12/06/2016
  Querying EDGAR (CIK: 0001381074) from 2016-06-09 to 2016-12-21
  Found 7 relevant filings
    ✓ 6-K on 2016-12-09 - Score: 0 (Tier F)
    ✓ 6-K on 2016-12-05 - Score: 7 (Tier A)
    ✓ 6-K on 2016-11-28 - Score: 8 (Tier A)
    ✓ 6-K on 2016-11-23 - Score: 5 (Tier A)
    ✓ 6-K on 2016-11-23 - Score: 0 (Tier F)
    ✓ 6-K on 2016-11-22 - Score: 7 (Tier A)
    ✓ 6-K on 2016-08-25 - Score: 4 (Tier B)
  ✓ Saved 7 scored filings to MongoDB

Processing: ONCT - Split: 1 : 10 on 12/06/2016
  ✗ No CIK found for ONCT (Oncternal Therapeutics Inc)

Processing: AGRI - Split: 1 : 100 on 12/05/2024
  Querying EDGAR (CIK: 0001826397) from 2024-06-08 to 2024-12-20
  Found 24 relevant filings
    ✓ 8-K on 2024-12-04 - Score: 5 (Tier A)
    ✓ 8-K on 2024-11-29 - Score: 5 (Tier A)
    ✓ DEFA14A on 2024-11-22 - Score: 0 (Tier F)
    ✓ DEFA14A on 2024-11-21 - Score: 2 (Tier C)
    ✓ 10-Q on 2024-11-19 - Score: 4 (Tier B)
    ✓ 8-K on 2024-11-13 - Score: 4 (Tier B)
    ✓ 8-K on 2024-10-29 - Score: 4 (Tier B)
    ✓ 424B5 on 2024-10-28 - Score: 2 (Tier C)
    ✓ DEF 14A on 2024-10-18 - Score: 7 (Tier A)
    ✓ 8-K on 2024-10-16 - Score: 4 (Tier B)
  ✓ Saved 10 scored filings to MongoDB

Processing: ZVSA - Split: 1 : 35 on 12/05/2023
  Querying EDGAR (CIK: 0001859007) from 2023-06-08 to 2023-12-20
  Found 19 relevant filings
    ✓ 8-K on 2023-12-11 - Score: 4 (Tier B)
    ✓ 8-K on 2023-11-30 - Score: 7 (Tier A)
    ✓ 424B3 on 2023-11-20 - Score: 4 (Tier B)
    ✓ 8-K on 2023-11-17 - Score: 7 (Tier A)
    ✓ 10-Q on 2023-11-14 - Score: 3 (Tier B)
    ✓ S-1 on 2023-11-03 - Score: 6 (Tier A)
    ✓ 8-K on 2023-11-02 - Score: 7 (Tier A)
    ✓ 424B3 on 2023-10-24 - Score: 6 (Tier A)
    ✓ 8-K on 2023-09-14 - Score: 8 (Tier A)
    ✓ DEFA14A on 2023-09-13 - Score: 0 (Tier F)
  ✓ Saved 10 scored filings to MongoDB

Processing: ASTC - Split: 1 : 30 on 12/05/2022
  Querying EDGAR (CIK: 0001001907) from 2022-06-08 to 2022-12-20
  Found 12 relevant filings
    ✓ 8-K on 2022-11-23 - Score: 8 (Tier A)
    ✓ 8-K on 2022-11-15 - Score: 4 (Tier B)
    ✓ 10-Q on 2022-11-14 - Score: 1 (Tier C)
    ✓ 8-K on 2022-11-10 - Score: 4 (Tier B)
    ✓ DEF 14A on 2022-09-26 - Score: 7 (Tier A)
    ✓ PRE 14A on 2022-09-15 - Score: 7 (Tier A)
    ✓ 10-K on 2022-09-15 - Score: 3 (Tier B)
    ✓ 8-K on 2022-09-14 - Score: 4 (Tier B)
    ✓ 8-K on 2022-08-24 - Score: 4 (Tier B)
    ✓ 8-K on 2022-07-01 - Score: 5 (Tier A)
  ✓ Saved 10 scored filings to MongoDB

Processing: NMRD - Split: 1 : 10 on 12/05/2019
  ✗ No CIK found for NMRD (Nemaura Medical Inc)

Processing: PCOA - Split: 1 : 100 on 12/05/2017
  ✗ No CIK found for PCOA (Pendrell Corp)

Processing: COWN - Split: 1 : 4 on 12/05/2016
  ✗ No CIK found for COWN (Cowen Inc)

Processing: CTSO - Split: 1 : 25 on 12/05/2014
  Querying EDGAR (CIK: 0001175151) from 2014-06-08 to 2014-12-20
  Found 18 relevant filings
    ✓ 8-K on 2014-12-18 - Score: 4 (Tier B)
    ✓ 8-K on 2014-12-16 - Score: 0 (Tier F)
    ✓ 8-K on 2014-12-08 - Score: 0 (Tier F)
    ✓ 8-K on 2014-12-04 - Score: 7 (Tier A)
    ✓ 8-K on 2014-12-02 - Score: 6 (Tier A)
    ✓ 8-K on 2014-11-17 - Score: 6 (Tier A)
    ✓ 8-K on 2014-11-14 - Score: 6 (Tier A)
    ✓ 8-K on 2014-11-14 - Score: 0 (Tier F)
    ✓ DEFA14A on 2014-11-14 - Score: 0 (Tier F)
    ✓ 10-Q on 2014-11-12 - Score: 2 (Tier C)
  ✓ Saved 10 scored filings to MongoDB

Processing: GPRC - Split: 1 : 2 on 12/05/2012
  ✗ No CIK found for GPRC (Guanwei Recycling Corp)

Processing: CBMX - Split: 1 : 10 on 12/05/2012
  ✗ No CIK found for CBMX (Combimatrix Corp)

Processing: RNAZ - Split: 1 : 33 on 12/04/2024
  Querying EDGAR (CIK: 0001829635) from 2024-06-07 to 2024-12-19
  Found 22 relevant filings
    ✓ PRE 14A on 2024-12-19 - Score: 7 (Tier A)
    ✓ S-1 on 2024-12-06 - Score: 6 (Tier A)
    ✓ 8-K on 2024-12-02 - Score: 5 (Tier A)
    ✓ 8-K on 2024-11-29 - Score: 8 (Tier A)
    ✓ 8-K on 2024-11-25 - Score: 6 (Tier A)
    ✓ 10-Q on 2024-11-14 - Score: 3 (Tier B)
    ✓ DEFA14A on 2024-11-13 - Score: 3 (Tier B)
    ✓ DEFA14A on 2024-11-06 - Score: 3 (Tier B)
    ✓ 8-K on 2024-11-06 - Score: 5 (Tier A)
    ✓ DEF 14A on 2024-10-28 - Score: 5 (Tier A)
  ✓ Saved 10 scored filings to MongoDB

Processing: APVO - Split: 1 : 37 on 12/04/2024
  Querying EDGAR (CIK: 0001671584) from 2024-06-07 to 2024-12-19
  Found 25 relevant filings
    ✓ 8-K on 2024-12-12 - Score: 4 (Tier B)
    ✓ 8-K on 2024-12-12 - Score: 4 (Tier B)
    ✓ 8-K on 2024-12-04 - Score: 4 (Tier B)
    ✓ 8-K on 2024-12-03 - Score: 7 (Tier A)
    ✓ 8-K on 2024-11-26 - Score: 4 (Tier B)
    ✓ 8-K on 2024-11-22 - Score: 4 (Tier B)
    ✓ 8-K on 2024-11-20 - Score: 4 (Tier B)
    ✓ 10-Q on 2024-11-07 - Score: 5 (Tier A)
    ✓ 8-K on 2024-11-07 - Score: 4 (Tier B)
    ✓ 8-K on 2024-11-04 - Score: 5 (Tier A)
  ✓ Saved 10 scored filings to MongoDB

Processing: CHAI - Split: 1 : 7 on 12/04/2023
  Querying EDGAR (CIK: 0001649009) from 2023-06-07 to 2023-12-19
  Found 34 relevant filings
    ✓ 6-K on 2023-12-07 - Score: 0 (Tier F)
    ✓ 6-K on 2023-12-04 - Score: 4 (Tier B)
    ✓ 6-K on 2023-11-30 - Score: 4 (Tier B)
    ✓ 6-K on 2023-11-29 - Score: 4 (Tier B)
    ✓ 6-K on 2023-11-27 - Score: 0 (Tier F)
    ✓ 6-K on 2023-11-15 - Score: 0 (Tier F)
    ✓ 6-K on 2023-11-13 - Score: 4 (Tier B)
    ✓ 6-K on 2023-11-01 - Score: 0 (Tier F)
    ✓ 6-K on 2023-11-01 - Score: 0 (Tier F)
    ✓ 6-K on 2023-10-24 - Score: 0 (Tier F)
  ✓ Saved 10 scored filings to MongoDB

Processing: BNRG - Split: 1 : 10 on 12/04/2023
  Querying EDGAR (CIK: 0001901215) from 2023-06-07 to 2023-12-19
  Found 29 relevant filings
    ✓ 6-K on 2023-12-14 - Score: 0 (Tier F)
    ✓ 6-K on 2023-12-13 - Score: 0 (Tier F)
    ✓ 6-K on 2023-12-06 - Score: 0 (Tier F)
    ✓ 6-K on 2023-12-05 - Score: 9 (Tier A)
    ✓ 6-K on 2023-11-30 - Score: 6 (Tier A)
    ✓ 6-K on 2023-11-14 - Score: 5 (Tier A)
    ✓ 6-K on 2023-11-01 - Score: 0 (Tier F)
    ✓ 6-K on 2023-10-27 - Score: 0 (Tier F)
    ✓ 6-K on 2023-10-12 - Score: 0 (Tier F)
    ✓ 6-K on 2023-09-12 - Score: 0 (Tier F)
  ✓ Saved 10 scored filings to MongoDB

Processing: MCOM - Split: 1 : 149.93 on 12/04/2023
  Querying EDGAR (CIK: 0001788841) from 2023-06-07 to 2023-12-19
  Found 26 relevant filings
    ✓ 8-K on 2023-12-19 - Score: 4 (Tier B)
    ✓ 8-K on 2023-12-15 - Score: 6 (Tier A)
    ✓ PRE 14A on 2023-12-13 - Score: 8 (Tier A)
    ✓ 8-K on 2023-12-11 - Score: 4 (Tier B)
    ✓ 8-K on 2023-12-04 - Score: 8 (Tier A)
    ✓ 8-K on 2023-12-01 - Score: 7 (Tier A)
    ✓ 10-Q on 2023-11-14 - Score: 5 (Tier A)
    ✓ 8-K on 2023-11-13 - Score: 7 (Tier A)
    ✓ 8-K on 2023-11-09 - Score: 4 (Tier B)
    ✓ 8-K on 2023-11-03 - Score: 4 (Tier B)
  ✓ Saved 10 scored filings to MongoDB

Progress: 250/1000 splits processed

Processing: SSNYQ - Split: 1 : 10 on 12/04/2018
  ✗ No CIK found for SSNYQ (Samson Oil & Gas Ltd.)

Processing: SYNE - Split: 1 : 8 on 12/04/2017
  ✗ No CIK found for SYNE (Synthesis Energy Systems Inc)

Processing: FCEL - Split: 1 : 12 on 12/04/2015
  Querying EDGAR (CIK: 0000886128) from 2015-06-07 to 2015-12-19
  Found 9 relevant filings
    ✓ 8-K on 2015-12-15 - Score: 0 (Tier F)
    ✓ 8-K on 2015-12-03 - Score: 7 (Tier A)
    ✓ 8-K on 2015-11-12 - Score: 0 (Tier F)
    ✓ 10-Q on 2015-09-09 - Score: 0 (Tier F)
    ✓ 8-K on 2015-09-09 - Score: 0 (Tier F)
    ✓ 8-K on 2015-08-14 - Score: 5 (Tier A)
    ✓ 8-K on 2015-08-07 - Score: 0 (Tier F)
    ✓ 8-K on 2015-06-10 - Score: 0 (Tier F)
    ✓ 10-Q on 2015-06-09 - Score: 0 (Tier F)
  ✓ Saved 9 scored filings to MongoDB

Processing: MYNZ - Split: 1 : 40 on 12/03/2024
  Querying EDGAR (CIK: 0001874252) from 2024-06-06 to 2024-12-18
  Found 10 relevant filings
    ✓ 6-K on 2024-12-16 - Score: 0 (Tier F)
    ✓ 424B3 on 2024-12-16 - Score: 6 (Tier A)
    ✓ 6-K on 2024-12-13 - Score: 3 (Tier B)
    ✓ 6-K on 2024-11-29 - Score: 0 (Tier F)
    ✓ 6-K on 2024-11-15 - Score: 0 (Tier F)
    ✓ 6-K on 2024-11-12 - Score: 0 (Tier F)
    ✓ 6-K on 2024-10-21 - Score: 0 (Tier F)
    ✓ 6-K on 2024-10-18 - Score: 0 (Tier F)
    ✓ 6-K on 2024-10-09 - Score: 0 (Tier F)
    ✓ 6-K on 2024-10-03 - Score: 0 (Tier F)
  ✓ Saved 10 scored filings to MongoDB

Processing: NBRVF - Split: 1 : 10 on 12/03/2020
